,Unnamed: 0,title,company,location,link,description,skills
0,0,Stay At Home Product Tester (In-Home Usage Tester),KADANSE,"Toronto, Ontario, Canada",https://ca.linkedin.com/jobs/view/stay-at-home-product-tester-in-home-usage-tester-at-kadanse-3045015611?refId=f8z1eMnAgP1RlSLryKJjgQ%3D%3D&trackingId=GGlfyPzuB5Pey1qN0%2BcCDg%3D%3D&position=1&pageNum=0&trk=public_jobs_jserp-result_search-card,"
        Entry-level job - Work From Home. Full or part-time placements offered from home. With or without experience we motivate all candidates to apply.<br><br>We are looking for candidates curious about dealing with companies that are hiring workers for remote at home positions. Both full-time and part-time opportunities are offered in a range of career fields consisting of but not limited to data entry, advertising and marketing, client service and also support, clerical, and administrative. Candidates with experience in within sales, outside sales, as well as retail sales are likewise urged to apply on our site. If you can work on your own from home and are self-motivated you would certainly be a fantastic fit. Perfect candidates should delight in such job as email customer support, information access, social media posting and reviewing products. Data entry clerks originate from all various backgrounds including client service, sales support, clerical, secretary, administrative assistant, receptionist, call center, part-time, retail fields &amp; even more We are wanting to hear from you. Please apply on our website today!<br><br><strong><u>Requirements<br><br></u></strong>Computer with internet access<br><br>Silent workspace far from interruptions<br><br>Determination to take direction
      ",[]
1,1,(Canada) Stay At Home Product Tester (In-Home Usage Tester),KADANSE,"Toronto, Ontario, Canada",https://ca.linkedin.com/jobs/view/canada-stay-at-home-product-tester-in-home-usage-tester-at-kadanse-3045018287?refId=f8z1eMnAgP1RlSLryKJjgQ%3D%3D&trackingId=TOE4LsOIf8EPzsh%2BHIQrVA%3D%3D&position=2&pageNum=0&trk=public_jobs_jserp-result_search-card,"
        Entry-level job - Work From Home. Full or part-time placements offered from home. With or without experience we motivate all candidates to apply.<br><br>We are looking for candidates curious about dealing with companies that are hiring workers for remote at home positions. Both full-time and part-time opportunities are offered in a range of career fields consisting of but not limited to data entry, advertising and marketing, client service and also support, clerical, and administrative. Candidates with experience in within sales, outside sales, as well as retail sales are likewise urged to apply on our site. If you can work on your own from home and are self-motivated you would certainly be a fantastic fit. Perfect candidates should delight in such job as email customer support, information access, social media posting and reviewing products. Data entry clerks originate from all various backgrounds including client service, sales support, clerical, secretary, administrative assistant, receptionist, call center, part-time, retail fields &amp; even more We are wanting to hear from you. Please apply on our website today!<br><br><strong><u>Requirements<br><br></u></strong>Computer with internet access<br><br>Silent workspace far from interruptions<br><br>Determination to take direction
      ",[]
2,2,Child Minder,The Womb,"Burlington, Ontario, Canada",https://ca.linkedin.com/jobs/view/child-minder-at-the-womb-2869570067?refId=f8z1eMnAgP1RlSLryKJjgQ%3D%3D&trackingId=yuHzy5eVSJQ2CSfBL70G2g%3D%3D&position=3&pageNum=0&trk=public_jobs_jserp-result_search-card,"
        <p><strong>About The WOMB: The WORLD OF MY BABY&nbsp;</strong></p><p>The WOMB is a place of origin, growth and love. It is a gathering space and wholeness centre that nurtures and nourishes families to flourish by providing and inspiring commUNITY and CONNECTion.&nbsp;</p><p>&nbsp;</p><p>The WOMB provides whole health care, education, fitness and products on the journey through conscious creation, informed pregnancy, mindful birth, parenting and self growth. It is a centre of excellence; a place where expert practitioners of health and research provide families with the best care possible. &nbsp;</p><p>&nbsp;</p><p><strong>Role: </strong>Child Minder</p><p>&nbsp;</p><p><strong>Locations: </strong>Milton &amp; Burlington, ON&nbsp;</p><p>&nbsp;</p><p><strong>Role Overview:&nbsp;</strong></p><p>The WOMB is looking for a Child Minder to join our teams! While clients enjoy The WOMB’s support and services,&nbsp; child(ren) are cared for by our friendly staff. Our staff provide a safe, healthy and happy environment for children, newborn to 6 years of age. The ideal candidate not only believes in our mission and values but also has a passion for providing exceptional care to our clients ranging from fertility, pregnancy, paediatrics and the family as a whole.</p><p>&nbsp;</p><p><strong>Responsibilities:</strong></p><ul><li>Child minding</li><li>Ensure copies of child minding agreement and sign in sheets</li><li>Upkeep of child minding binder</li><li>Ensure cleanliness of toys</li><li>Loving care of children 6 years and under</li><li>Up to 4 children at one time</li><li>Creating a safe and fun environment&nbsp;</li><li>Laundry</li><li>Ensure supply of hand towels are stocked in bathrooms</li><li>Linens are in correct rooms</li><li>Organization of Shelving in storage closets and laundry room</li><li>Monitor supply of detergent and need for more linens</li><li>Daily cleaning</li><li>Organize front Desk</li><li>Hours:&nbsp;</li><li>Burlington: Monday, Wednesday, Friday 10-2</li><li>Milton: Tuesday, Thursday 10-2</li></ul><p><strong>Qualifications:</strong></p><ul><li>ECE or equivalent&nbsp;</li><li>Positive, professional and flexible</li><li>A patient, caring and loving attitude</li><li>Ability to work in a team environment</li><li>First Aid/CPR an asset&nbsp;</li></ul><p>&nbsp;</p><p><strong>Application:&nbsp;</strong></p><p>Please email your cover letter and resume to HR@thewomb.ca</p><p><br></p><p><br></p>
      ","['Ensure cleanliness of toys', 'Ensure copies of child minding agreement and sign in sheets', 'Organize front Desk', 'Positive, professional and flexible', 'Loving care of children 6 years and under', 'First Aid/CPR an asset', 'Creating a safe and fun environment', 'Daily cleaning', 'Ensure supply of hand towels are stocked in bathrooms']"
3,3,Manager Home Childcare Services,Rural Family Connections,"Ottawa, Ontario, Canada",https://ca.linkedin.com/jobs/view/manager-home-childcare-services-at-rural-family-connections-3058880831?refId=f8z1eMnAgP1RlSLryKJjgQ%3D%3D&trackingId=HEUbeQ1SyC0H8Sq2sQW2kg%3D%3D&position=4&pageNum=0&trk=public_jobs_jserp-result_search-card,"
        <p><strong>Manager Home Childcare Services</strong></p><p><strong>Location:&nbsp;&nbsp;various locations throughout Ottawa South&nbsp;</strong></p><p><strong>Office Location</strong>&nbsp;– Metcalfe, ON</p><p><strong>Work Term:&nbsp;</strong>Permanent, Full Time, 35 hours per week</p><p><strong>RURAL FAMILY CONNECTIONS</strong>&nbsp;is a non-profit, licensed childcare operator serving children from 0 to 12 years of age.&nbsp;Licensed under the Ministry of Education, we proudly serve an expanding South Ottawa community, including South Gloucester (Findlay Creek, Blossom Park), Riverside South, Osgoode Ward (Greely, Metcalfe, Vernon, Kenmore, Osgoode), Rideau Ward (North Gower, Kars), South Keys, Hunt Club, the surrounding rural areas and the area stretching north to Heron Road between Riverside Drive and just east of Conroy Road.&nbsp;We work alongside our home care providers to provide inclusive, play-based programming in their homes to ensure the best learning and growing environment for the children and families we serve.&nbsp;</p><p><strong>Position</strong></p><p><strong>We are continuing to grow and expand at RFC!</strong></p><p>This will allow for an expansion of high-quality, licensed childcare services for families and will allow us to meet families' ever-changing and unique needs across our Region. Reporting to the Executive Director, this individual will be responsible for leading our organization to continue our successful licensed home childcare, including the recruitment of home childcare providers and children. This individual will be responsible for overseeing and monitoring licensed home childcare consultants, providing opportunities for professional networking and resourcing and pedagogical support. This individual will ensure management practices that reflect the organization's philosophy, promote quality early childhood education and care, provide a safe and supportive work/play environment, promote positive relations with families and partners, and demonstrate sound legislative understanding and adherence.</p><p><strong><em>Responsibilities:&nbsp;</em></strong></p><p><strong>Applicant expectations:&nbsp;</strong></p><ul><li>Develop and implement a marketing strategy to recruit new home childcare providers, including influencing existing unlicensed home care providers to become licensed;</li><li>Recruiting of new families to our licenced agency;&nbsp;</li><li>Promote community awareness and highlight the benefits of becoming licensed home childcare;</li><li>Develop and maintain strategic community partnerships;</li><li>Develop and implement a process to onboard licensed home childcare providers to include; external postings, interviews, screening protocols, vulnerable sector checks and licensing/administrative support;</li><li>Conduct initial home visits to ensure a provider is ready to open;</li><li>Review and coordinate signing of all applicable agreements and paperwork between the home childcare provider and Rural Family Connections.</li><li>Attend monthly manager meetings;&nbsp;</li><li>Ensure all documentation, policies, and procedures are current and up to date;&nbsp;</li><li>Evaluate programming and home childcare consultants;<strong>&nbsp;</strong></li><li>Promotion of licensed home childcare;</li><li>Assist home childcare providers in filling any vacancies within their homes;</li><li>Work with community partners to develop strong community relations.</li></ul><p><strong>Requirements:&nbsp;</strong></p><ul><li>Strong verbal and non-verbal communication skills in English; French an asset</li><li>Excellent organizational, planning and empowering skills</li><li>Effective conflict resolution and problem-solving skills</li><li>Ability to develop and maintain positive community connections</li><li>Professional work ethic and ability to maintain confidentiality</li><li>Enthusiastic, positive, and solution-focused</li><li>Advanced computer skills, knowledge of marketing through social media</li><li>College Diploma or University Degree in Early Childhood Education</li><li>University degree in relevant area; childcare, social services, business&nbsp;</li><li>Minimum of 5 years of management experience</li><li>Experience in Home Childcare would be an asset</li><li>Experience with licensing under the Ministry of Education</li><li>Current Standard First Aid and CPR Level C qualification</li><li>Good standing with College of Early Childhood Educators.&nbsp;</li><li>Current, valid driver's license and vehicle&nbsp;</li><li>Strong understanding of Child Care and Early Years Act, How Does Learning Happen? ELECT, Universal childcare initiative.&nbsp;</li></ul><p><br></p><p>Please email Lee Stanistreet your cover letter and resume to&nbsp;leestanistreet.rfc@gmail.com. Please put in the subject,&nbsp;<strong>Manager- Home Childcare Services.</strong></p><p><strong>Closing Date:&nbsp;</strong>May 13th,&nbsp;2022</p><p><br></p>
      ","['University degree in relevant area; childcare, social services, business', 'Experience in Home Childcare would be an asset', 'Minimum of 5 years of management experience', 'Current Standard First Aid and CPR Level C qualification', 'Excellent organizational, planning and empowering skills', ""Current, valid driver's license and vehicle"", 'Experience with licensing under the Ministry of Education', 'Strong verbal and non-verbal communication skills in English; French an asset', 'Work Term:\xa0Permanent, Full Time, 35 hours per week', 'Develop and maintain strategic community partnerships;', 'Applicant expectations:', 'Attend monthly manager meetings;', 'Good standing with College of Early Childhood Educators.', 'Strong understanding of Child Care and Early Years Act, How Does Learning Happen? ELECT, Universal childcare initiative.', 'Professional work ethic and ability to maintain confidentiality', 'College Diploma or University Degree in Early Childhood Education', 'Effective conflict resolution and problem-solving skills', 'Develop and implement a marketing strategy to recruit new home childcare providers, including influencing existing unlicensed home care providers to become licensed;', 'Ensure all documentation, policies, and procedures are current and up to date;', 'Conduct initial home visits to ensure a provider is ready to open;', 'Enthusiastic, positive, and solution-focused', 'Recruiting of new families to our licenced agency;', 'Develop and implement a process to onboard licensed home childcare providers to include; external postings, interviews, screening protocols, vulnerable sector checks and licensing/administrative support;', 'Review and coordinate signing of all applicable agreements and paperwork between the home childcare provider and Rural Family Connections.', 'Promote community awareness and highlight the benefits of becoming licensed home childcare;', 'Advanced computer skills, knowledge of marketing through social media', 'Work with community partners to develop strong community relations.', 'Assist home childcare providers in filling any vacancies within their homes;']"
4,4,"Child Care Educator Levels 1, 2, 3",Grovedale Daycare,"Grovedale, Alberta, Canada",https://ca.linkedin.com/jobs/view/child-care-educator-levels-1-2-3-at-grovedale-daycare-3028791474?refId=f8z1eMnAgP1RlSLryKJjgQ%3D%3D&trackingId=pZlE55Vi7Cp6S%2BMAnUnUzQ%3D%3D&position=5&pageNum=0&trk=public_jobs_jserp-result_search-card,"
        <p><strong>Manager Home Childcare Services</strong></p><p><strong>Location:&nbsp;&nbsp;various locations throughout Ottawa South&nbsp;</strong></p><p><strong>Office Location</strong>&nbsp;– Metcalfe, ON</p><p><strong>Work Term:&nbsp;</strong>Permanent, Full Time, 35 hours per week</p><p><strong>RURAL FAMILY CONNECTIONS</strong>&nbsp;is a non-profit, licensed childcare operator serving children from 0 to 12 years of age.&nbsp;Licensed under the Ministry of Education, we proudly serve an expanding South Ottawa community, including South Gloucester (Findlay Creek, Blossom Park), Riverside South, Osgoode Ward (Greely, Metcalfe, Vernon, Kenmore, Osgoode), Rideau Ward (North Gower, Kars), South Keys, Hunt Club, the surrounding rural areas and the area stretching north to Heron Road between Riverside Drive and just east of Conroy Road.&nbsp;We work alongside our home care providers to provide inclusive, play-based programming in their homes to ensure the best learning and growing environment for the children and families we serve.&nbsp;</p><p><strong>Position</strong></p><p><strong>We are continuing to grow and expand at RFC!</strong></p><p>This will allow for an expansion of high-quality, licensed childcare services for families and will allow us to meet families' ever-changing and unique needs across our Region. Reporting to the Executive Director, this individual will be responsible for leading our organization to continue our successful licensed home childcare, including the recruitment of home childcare providers and children. This individual will be responsible for overseeing and monitoring licensed home childcare consultants, providing opportunities for professional networking and resourcing and pedagogical support. This individual will ensure management practices that reflect the organization's philosophy, promote quality early childhood education and care, provide a safe and supportive work/play environment, promote positive relations with families and partners, and demonstrate sound legislative understanding and adherence.</p><p><strong><em>Responsibilities:&nbsp;</em></strong></p><p><strong>Applicant expectations:&nbsp;</strong></p><ul><li>Develop and implement a marketing strategy to recruit new home childcare providers, including influencing existing unlicensed home care providers to become licensed;</li><li>Recruiting of new families to our licenced agency;&nbsp;</li><li>Promote community awareness and highlight the benefits of becoming licensed home childcare;</li><li>Develop and maintain strategic community partnerships;</li><li>Develop and implement a process to onboard licensed home childcare providers to include; external postings, interviews, screening protocols, vulnerable sector checks and licensing/administrative support;</li><li>Conduct initial home visits to ensure a provider is ready to open;</li><li>Review and coordinate signing of all applicable agreements and paperwork between the home childcare provider and Rural Family Connections.</li><li>Attend monthly manager meetings;&nbsp;</li><li>Ensure all documentation, policies, and procedures are current and up to date;&nbsp;</li><li>Evaluate programming and home childcare consultants;<strong>&nbsp;</strong></li><li>Promotion of licensed home childcare;</li><li>Assist home childcare providers in filling any vacancies within their homes;</li><li>Work with community partners to develop strong community relations.</li></ul><p><strong>Requirements:&nbsp;</strong></p><ul><li>Strong verbal and non-verbal communication skills in English; French an asset</li><li>Excellent organizational, planning and empowering skills</li><li>Effective conflict resolution and problem-solving skills</li><li>Ability to develop and maintain positive community connections</li><li>Professional work ethic and ability to maintain confidentiality</li><li>Enthusiastic, positive, and solution-focused</li><li>Advanced computer skills, knowledge of marketing through social media</li><li>College Diploma or University Degree in Early Childhood Education</li><li>University degree in relevant area; childcare, social services, business&nbsp;</li><li>Minimum of 5 years of management experience</li><li>Experience in Home Childcare would be an asset</li><li>Experience with licensing under the Ministry of Education</li><li>Current Standard First Aid and CPR Level C qualification</li><li>Good standing with College of Early Childhood Educators.&nbsp;</li><li>Current, valid driver's license and vehicle&nbsp;</li><li>Strong understanding of Child Care and Early Years Act, How Does Learning Happen? ELECT, Universal childcare initiative.&nbsp;</li></ul><p><br></p><p>Please email Lee Stanistreet your cover letter and resume to&nbsp;leestanistreet.rfc@gmail.com. Please put in the subject,&nbsp;<strong>Manager- Home Childcare Services.</strong></p><p><strong>Closing Date:&nbsp;</strong>May 13th,&nbsp;2022</p><p><br></p>
      ","['University degree in relevant area; childcare, social services, business', 'Experience in Home Childcare would be an asset', 'Minimum of 5 years of management experience', 'Current Standard First Aid and CPR Level C qualification', 'Excellent organizational, planning and empowering skills', ""Current, valid driver's license and vehicle"", 'Experience with licensing under the Ministry of Education', 'Strong verbal and non-verbal communication skills in English; French an asset', 'Work Term:\xa0Permanent, Full Time, 35 hours per week', 'Develop and maintain strategic community partnerships;', 'Applicant expectations:', 'Attend monthly manager meetings;', 'Good standing with College of Early Childhood Educators.', 'Strong understanding of Child Care and Early Years Act, How Does Learning Happen? ELECT, Universal childcare initiative.', 'Professional work ethic and ability to maintain confidentiality', 'College Diploma or University Degree in Early Childhood Education', 'Effective conflict resolution and problem-solving skills', 'Develop and implement a marketing strategy to recruit new home childcare providers, including influencing existing unlicensed home care providers to become licensed;', 'Ensure all documentation, policies, and procedures are current and up to date;', 'Conduct initial home visits to ensure a provider is ready to open;', 'Enthusiastic, positive, and solution-focused', 'Recruiting of new families to our licenced agency;', 'Develop and implement a process to onboard licensed home childcare providers to include; external postings, interviews, screening protocols, vulnerable sector checks and licensing/administrative support;', 'Review and coordinate signing of all applicable agreements and paperwork between the home childcare provider and Rural Family Connections.', 'Promote community awareness and highlight the benefits of becoming licensed home childcare;', 'Advanced computer skills, knowledge of marketing through social media', 'Work with community partners to develop strong community relations.', 'Assist home childcare providers in filling any vacancies within their homes;']"
