,Unnamed: 0,title,company,location,link,description,skills
5,5,Soutien à domicile,Soins et services a domicile Chantal Pelletier,"Montréal-Est, Quebec, Canada",https://ca.linkedin.com/jobs/view/soutien-%C3%A0-domicile-at-soins-et-services-a-domicile-chantal-pelletier-3047161350?refId=f8z1eMnAgP1RlSLryKJjgQ%3D%3D&trackingId=MfglP5SrkEcKQNkSJRiDfA%3D%3D&position=6&pageNum=0&trk=public_jobs_jserp-result_search-card,"
        <p><strong>Manager Home Childcare Services</strong></p><p><strong>Location:&nbsp;&nbsp;various locations throughout Ottawa South&nbsp;</strong></p><p><strong>Office Location</strong>&nbsp;– Metcalfe, ON</p><p><strong>Work Term:&nbsp;</strong>Permanent, Full Time, 35 hours per week</p><p><strong>RURAL FAMILY CONNECTIONS</strong>&nbsp;is a non-profit, licensed childcare operator serving children from 0 to 12 years of age.&nbsp;Licensed under the Ministry of Education, we proudly serve an expanding South Ottawa community, including South Gloucester (Findlay Creek, Blossom Park), Riverside South, Osgoode Ward (Greely, Metcalfe, Vernon, Kenmore, Osgoode), Rideau Ward (North Gower, Kars), South Keys, Hunt Club, the surrounding rural areas and the area stretching north to Heron Road between Riverside Drive and just east of Conroy Road.&nbsp;We work alongside our home care providers to provide inclusive, play-based programming in their homes to ensure the best learning and growing environment for the children and families we serve.&nbsp;</p><p><strong>Position</strong></p><p><strong>We are continuing to grow and expand at RFC!</strong></p><p>This will allow for an expansion of high-quality, licensed childcare services for families and will allow us to meet families' ever-changing and unique needs across our Region. Reporting to the Executive Director, this individual will be responsible for leading our organization to continue our successful licensed home childcare, including the recruitment of home childcare providers and children. This individual will be responsible for overseeing and monitoring licensed home childcare consultants, providing opportunities for professional networking and resourcing and pedagogical support. This individual will ensure management practices that reflect the organization's philosophy, promote quality early childhood education and care, provide a safe and supportive work/play environment, promote positive relations with families and partners, and demonstrate sound legislative understanding and adherence.</p><p><strong><em>Responsibilities:&nbsp;</em></strong></p><p><strong>Applicant expectations:&nbsp;</strong></p><ul><li>Develop and implement a marketing strategy to recruit new home childcare providers, including influencing existing unlicensed home care providers to become licensed;</li><li>Recruiting of new families to our licenced agency;&nbsp;</li><li>Promote community awareness and highlight the benefits of becoming licensed home childcare;</li><li>Develop and maintain strategic community partnerships;</li><li>Develop and implement a process to onboard licensed home childcare providers to include; external postings, interviews, screening protocols, vulnerable sector checks and licensing/administrative support;</li><li>Conduct initial home visits to ensure a provider is ready to open;</li><li>Review and coordinate signing of all applicable agreements and paperwork between the home childcare provider and Rural Family Connections.</li><li>Attend monthly manager meetings;&nbsp;</li><li>Ensure all documentation, policies, and procedures are current and up to date;&nbsp;</li><li>Evaluate programming and home childcare consultants;<strong>&nbsp;</strong></li><li>Promotion of licensed home childcare;</li><li>Assist home childcare providers in filling any vacancies within their homes;</li><li>Work with community partners to develop strong community relations.</li></ul><p><strong>Requirements:&nbsp;</strong></p><ul><li>Strong verbal and non-verbal communication skills in English; French an asset</li><li>Excellent organizational, planning and empowering skills</li><li>Effective conflict resolution and problem-solving skills</li><li>Ability to develop and maintain positive community connections</li><li>Professional work ethic and ability to maintain confidentiality</li><li>Enthusiastic, positive, and solution-focused</li><li>Advanced computer skills, knowledge of marketing through social media</li><li>College Diploma or University Degree in Early Childhood Education</li><li>University degree in relevant area; childcare, social services, business&nbsp;</li><li>Minimum of 5 years of management experience</li><li>Experience in Home Childcare would be an asset</li><li>Experience with licensing under the Ministry of Education</li><li>Current Standard First Aid and CPR Level C qualification</li><li>Good standing with College of Early Childhood Educators.&nbsp;</li><li>Current, valid driver's license and vehicle&nbsp;</li><li>Strong understanding of Child Care and Early Years Act, How Does Learning Happen? ELECT, Universal childcare initiative.&nbsp;</li></ul><p><br></p><p>Please email Lee Stanistreet your cover letter and resume to&nbsp;leestanistreet.rfc@gmail.com. Please put in the subject,&nbsp;<strong>Manager- Home Childcare Services.</strong></p><p><strong>Closing Date:&nbsp;</strong>May 13th,&nbsp;2022</p><p><br></p>
      ","['University degree in relevant area; childcare, social services, business', 'Experience in Home Childcare would be an asset', 'Minimum of 5 years of management experience', 'Current Standard First Aid and CPR Level C qualification', 'Excellent organizational, planning and empowering skills', ""Current, valid driver's license and vehicle"", 'Experience with licensing under the Ministry of Education', 'Strong verbal and non-verbal communication skills in English; French an asset', 'Work Term:\xa0Permanent, Full Time, 35 hours per week', 'Develop and maintain strategic community partnerships;', 'Applicant expectations:', 'Attend monthly manager meetings;', 'Good standing with College of Early Childhood Educators.', 'Strong understanding of Child Care and Early Years Act, How Does Learning Happen? ELECT, Universal childcare initiative.', 'Professional work ethic and ability to maintain confidentiality', 'College Diploma or University Degree in Early Childhood Education', 'Effective conflict resolution and problem-solving skills', 'Develop and implement a marketing strategy to recruit new home childcare providers, including influencing existing unlicensed home care providers to become licensed;', 'Ensure all documentation, policies, and procedures are current and up to date;', 'Conduct initial home visits to ensure a provider is ready to open;', 'Enthusiastic, positive, and solution-focused', 'Recruiting of new families to our licenced agency;', 'Develop and implement a process to onboard licensed home childcare providers to include; external postings, interviews, screening protocols, vulnerable sector checks and licensing/administrative support;', 'Review and coordinate signing of all applicable agreements and paperwork between the home childcare provider and Rural Family Connections.', 'Promote community awareness and highlight the benefits of becoming licensed home childcare;', 'Advanced computer skills, knowledge of marketing through social media', 'Work with community partners to develop strong community relations.', 'Assist home childcare providers in filling any vacancies within their homes;']"
6,6,Early Learning and Childcare Instructor,Robertson College,"Edmonton, Alberta, Canada",https://ca.linkedin.com/jobs/view/early-learning-and-childcare-instructor-at-robertson-college-3018970382?refId=f8z1eMnAgP1RlSLryKJjgQ%3D%3D&trackingId=zLEHFHw5V1b5nV54lmhcSw%3D%3D&position=7&pageNum=0&trk=public_jobs_jserp-result_search-card,"
        <p><strong>Robertson is the School of New Work</strong>. Our vision is for everyone to have a good life through a prosperous and fulfilling career. Robertson’s mission is to empower our students with the most relevant training and up-to-date industry insights to thrive in a modern work environment.</p><p><br></p><p>At Robertson, motivated students can advance their education at their own schedule. The Robertson team assists both during and after graduation to ensure students have the tools they need to succeed in a new career. Robertson team members are guides for our students on their career path as they navigate their college and educational experiences during their time at Robertson.</p><p><br></p><p>Education Canada Group (the parent company of Robertson College) is an equal opportunity employer. We celebrate diversity in our inclusive work environment and encourage people from all walks of life to apply. We are committed to fostering an inclusive and diverse environment where everyone feels seen, heard and valued. We embrace our team's differences and know that diversity in our team is the strength that drives our success. We want you to feel welcomed, energized, challenged, and engaged while having fun. Come and grow with us! If you are someone who loves the highs and lows of doing meaningful work with like-minded team members, we’d like you to join us.</p><p><br></p><p><strong>KEY RESPONSIBILITIES</strong></p><ul><li>Share industry-related knowledge, expertise, and passion with the students</li><li>Respond to student inquiries and provide feedback to students in a respectful and timely manner</li><li>Record student attendance and grades</li><li>Attend onsite practicum placements and complete checklists</li><li>Develop and maintain a supportive learning community</li><li>Provide guidance and support to adult learners</li><li>Evaluate student performance fairly, promptly and consistently.</li><li>Collaborate with other teams (Student Services and Support, Practicum and Career Services, Academic Department, etc.) to contribute positively to the student experience</li><li>Act in a manner that upholds the professional expectations and standards of Robertson College</li><li><br></li></ul><p><strong>QUALIFICATIONS</strong></p><ul><li>Alberta ECE level 3 is required</li><li>5 years of experience working in a childcare setting required</li><li>Experience delivering training programs for professional and educational purposes an asset</li><li>Experience with Learning Management Systems (D2L preferred) and asset</li><li><br></li></ul><p><strong>SKILLS, ABILITIES, and ATTITUDES</strong></p><ul><li>Demonstrates confidence, a positive approach and a strong work ethic</li><li>Ability to plan, organize and prioritize tasks</li><li>Must be dependable, reliable and punctual</li><li>Ability to problem solve and process information</li><li>Team oriented and adaptable</li><li>Demonstrates multicultural sensitivity and awareness</li><li>Strong written and verbal communication skills</li><li>Proven organizational skills and ability to complete assignments timely and accurately with minimal supervision</li><li>Experience with andragogical training and teaching an asset</li><li><br></li></ul><p>Job Types: Part-time, Contract</p><p><br></p><p>COVID-19 considerations:</p><p> Remote interview process, virtual meetings</p><p></p>
      ","['Respond to student inquiries and provide feedback to students in a respectful and timely manner', 'Provide guidance and support to adult learners', 'Collaborate with other teams (Student Services and Support, Practicum and Career Services, Academic Department, etc.) to contribute positively to the student experience', 'Strong written and verbal communication skills', 'Experience with andragogical training and teaching an asset', 'Develop and maintain a supportive learning community', 'Experience delivering training programs for professional and educational purposes an asset', 'Demonstrates confidence, a positive approach and a strong work ethic', 'Must be dependable, reliable and punctual', 'Attend onsite practicum placements and complete checklists', 'Experience with Learning Management Systems (D2L preferred) and asset', '5 years of experience working in a childcare setting required', 'Demonstrates multicultural sensitivity and awareness', 'Proven organizational skills and ability to complete assignments timely and accurately with minimal supervision', 'Act in a manner that upholds the professional expectations and standards of Robertson College']"
7,7,Travailleur(euse) social(e) – Clientèle âgée à domicile – Lachine – Temps complet,CIUSSS de l'Ouest-de-l'Île-de-Montréal,"Montreal, Quebec, Canada",https://ca.linkedin.com/jobs/view/travailleur-euse-social-e-%E2%80%93-client%C3%A8le-%C3%A2g%C3%A9e-%C3%A0-domicile-%E2%80%93-lachine-%E2%80%93-temps-complet-at-ciusss-de-l-ouest-de-l-%C3%AEle-de-montr%C3%A9al-3028385170?refId=f8z1eMnAgP1RlSLryKJjgQ%3D%3D&trackingId=Ztjqlw6tewmKrwh7e7iGUw%3D%3D&position=8&pageNum=0&trk=public_jobs_jserp-result_search-card,"
        <strong><u>Description<br><br></u></strong>Le CIUSSS de l’Ouest-de-l’Île-de-Montréal est présentement à la recherche d’un(e) travailleur(euse) social(e) pour combler un poste temporaire à temps complet. L’emploi est basé à l’Ex-Hôpital générale de Lachine. Le/la candidat(e) sélectionné(e) sera majoritairement appelé(e) à travailler en ressources intermédiaires auprès des personnes en perte d’autonomie. L’emploi nécessite donc des déplacements sur le territoire du CIUSSS de l’Ouest-de-l’Île-de-Montréal.<br><br>À titre de travailleur(se) social(e) au sein de la Direction du programme de soutien à l’autonomie des personnes âgées, vous assurerez la meilleure prise en charge d’une clientèle ayant un profil gériatrique accompagné d’un état de santé physique et psychosocial complexe, mais présentant un potentiel de maintien à domicile.<br><br>Vos interventions viseront à favoriser l’autonomie des personnes, à soutenir leurs capacités de prendre des décisions pour elles-mêmes, à maintenir leur qualité de vie le plus longtemps possible dans le milieu et l’entourage qui leur est familier et à faciliter l’accès aux services auxquels elles ont droit. Votre rôle sera d’assurer la continuité des services au client et la concertation des membres de l’équipe multidisciplinaire quant à l’élaboration et au déploiement du plan d’intervention.<br><br><strong><u>Vos Fonctions Vous Appelleront à<br></u></strong><ul><li> Évaluer la situation psychosociale du client ainsi que ses besoins par la cueillette de données essentielles subjectives et objectives ainsi que par l’analyse de ces données;</li><li> Prioriser les besoins du client, identifier ses incapacités, ses limites et les limites de son réseau;</li><li> Procéder à la planification des services appropriés en tenant compte de la disponibilité de ressources;</li><li> Déterminer les partenaires à mobiliser (au sein de l’établissement, au sein du réseau, dans le secteur communautaire, etc.) et négocier l’accès aux ressources;</li><li> Intervenir au plan du fonctionnement social des résidents, notamment par rapport aux interactions entre ces derniers et leur environnement (milieu de vie, famille et proches, collectivité) dans le but d’assurer le développement optimal des capacités affectives, sociales et spirituelles et de maintenir ou améliorer la qualité de vie et le fonctionnement social;</li><li> Réaliser la coordination des services mis en place en assurant une communication optimale entre les différents partenaires impliqués (rôle d’agent de liaison);</li><li> Effectuer un monitorage des services reçus par le client pour assurer la continuité des interventions;</li><li> Réaliser un suivi clinique permettant de vérifier l’atteinte des objectifs du plan d’intervention et le réajustement de celui-ci, s’il y a lieu;</li><li> Réaliser les démarches et l’accompagnement nécessaires lors de la mise en place d’un régime de protection;</li><li> Exercer les fonctions transversales de représentation des intérêts du client et de défense de ses droits;</li><li> Travailler au sein d’une équipe multidisciplinaire avec qui vous partagerez le savoir qui vous distingue et participer aux rencontres d’équipe.<br></li></ul>Saisissez dès maintenant cette opportunité de travailler au sein d’une équipe dynamique et dédiée au bien-être de nos aînés, tout en participant activement au développement d’une offre intégrée de services de qualité optimale!<br><br>En vous joignant au CIUSSS de l’Ouest-de-l’Île-de-Montréal, vous profiterez d’une multitude d’avantages :<br><ul><li> Salaire concurrentiel auquel des primes peuvent s’ajouter (de 27,08$ jusqu’à 47,98$/heure);</li><li> Des bénéfices marginaux (vacances, journées de maladie) accumulés au prorata des journées travaillées;</li><li> Participation, avec l’employeur, à un régime de retraite à prestation déterminée assurant un revenu de retraite fiable;</li><li> Protection par des assurances collectives (vie, maladie, salaire);</li><li> Accès, pour vous et votre famille, à un programme d’aide aux employés gratuit;</li><li> Accès à de la formation continue (formation formelle, supervision, coaching, etc.);</li><li> Vastes possibilités de développement de carrière à l'interne.<br></li></ul><strong><u>Exigences<br><br></u></strong>Disponibilité recherchée : 8h00 à 16h00, du lundi au vendredi.<br><br><strong><u>Le/la Candidat(e) Recherché(e)<br></u></strong><ul><li> Doit détenir un baccalauréat ou une maîtrise en travail social ou diplôme jugé équivalent par une autorité compétente*;</li><li> Doit être inscrit(e) à titre de travailleur(se) social(e) au Tableau de Ordre des travailleurs sociaux et des thérapeutes conjugaux et familiaux du Québec;</li><li> Doit être apte à établir une relation thérapeutique avec une clientèle francophone et anglophone;</li><li> Doit avoir de l’expérience avec une clientèle gériatrique ou en soutien à domicile, un atout;</li><li> Doit posséder une connaissance des enjeux et problématiques liées au vieillissement (troubles cognitifs, démence, deuil, dynamiques familiales, régimes de protection, etc.);</li><li> Doit avoir un permis de conduire valide et accès à un véhicule pour les déplacements (kilométrage remboursé);</li><li> Sait faire preuve de patience et d’empathie.<br></li></ul>Vous vous reconnaissez dans ce profil? Déposez une candidature sans tarder!<br><ul><li>NB: Tout diplôme obtenu à l'étranger doit avoir fait l'objet d'une Évaluation comparative des études effectuées hors du Québec auprès du Ministère de l'Immigration, de la Francisation et de l'Intégration. Prière d'inscrire le résultat de l'évaluation dans votre CV, sans quoi votre candidature pourrait ne pas être considérée.<br></li></ul><strong><u>Remarques<br><br></u></strong>Nous remercions toutes les personnes qui poseront leur candidature, mais ne communiquerons qu’avec celles retenues pour une entrevue.<br><br>Le CIUSSS de l'Ouest-de-l'Île-de-Montréal applique un programme d'accès à l'égalité en emploi et invite les Autochtones, les minorités visibles, les minorités ethniques, les femmes et les personnes handicapées à présenter leur candidature. Les personnes handicapées peuvent également nous faire part de leurs besoins particuliers relativement au processus de sélection pour l'emploi sollicité afin de faciliter l'étude de leur candidature.<br><br>Si vous postulez d'un appareil mobile (téléphone intelligent, tablette), vous recevrez un courriel d'accusé réception vous demandant d'aller mettre à jour votre dossier et déposer votre CV afin que votre candidature soit prise en considération.
      ",[]
8,8,Childcare Educator,Clever Daycare,"Calgary, Alberta, Canada",https://ca.linkedin.com/jobs/view/childcare-educator-at-clever-daycare-3060097634?refId=f8z1eMnAgP1RlSLryKJjgQ%3D%3D&trackingId=CE9ZgzmAge3xTi7gT2JAuA%3D%3D&position=9&pageNum=0&trk=public_jobs_jserp-result_search-card,"
        <p>""Here we Grow Again""</p><p><br></p><p>At Clever Daycare, we are always willing to go the extra mile to ensure children are cared for and on a positive path towards social, emotional, and academic development. We work with children from 9 months of age to 6 years of age and are a fully licensed and have accredited childcare centers in Calgary, as well as an accredited BBB company.</p><p><br></p><p>Currently, we have an opening for Full-time and Part-time Childhood Educator ( CDA, CDW, CDS), Baby and toddler age experience is an asset.</p><p>Please note that helping in the centers kitchen is required.</p><p><br></p><p>Must have a clear CRC with a Vulnerable sector search dated within the last 6 months &amp; First Aid Certification or be willing to acquire within the 60 days of hiring date.</p><p>If you meet the above requirements, have the following skills and experience, and would like to join our dedicated team of childcare professionals, apply today.</p><p><br></p><p><strong>Job Type / Category</strong></p><p>Full time </p><p>Must be able to work a variable shift between the hours of 6 am and 6 pm Monday - Friday</p><p>Option of split shifts.</p><p>Parking provided</p><p>Full-time employees are eligible for health benefits after 3-month probation</p><p><br></p><p><strong>Required Education, Skills, and Qualifications</strong></p><p><br></p><ul><li>Must have a clear CRC with a Vulnerable sector search dated within the last 6 months &amp; First Aid Certification, or obtain them within 5 weeks of being hired.</li><li>Must have a minimum of 1-year of experience in childcare.</li><li>Must have a minimum of a CDA certification, preference is given for CDW, CDS.</li><li>Also, applicants who have a valid Class 4 driver's license will be welcomed.</li></ul><p>Benefits:</p><ul><li>On-site parking</li><li>Dental care</li><li>Life insurance</li><li>Vision care</li><li>Vacation &amp; paid time off</li></ul><p><br></p><p>COVID-19 considerations:</p><p><br></p><p>At this time educators are required to be fully vaccinated, masks are required within our centres and daily health screening forms and temperature checks are required.</p><p>Masks are worn</p>
      ","['On-site parking', 'Must have a clear CRC with a Vulnerable sector search dated within the last 6 months & First Aid Certification, or obtain them within 5 weeks of being hired.', 'Must have a minimum of 1-year of experience in childcare.', 'Currently, we have an opening for Full-time and Part-time Childhood Educator ( CDA, CDW, CDS), Baby and toddler age experience is an asset.', 'Must be able to work a variable shift between the hours of 6 am and 6 pm Monday - Friday', 'Must have a clear CRC with a Vulnerable sector search dated within the last 6 months & First Aid Certification or be willing to acquire within the 60 days of hiring date.', 'Full time', ""Also, applicants who have a valid Class 4 driver's license will be welcomed."", '""Here we Grow Again""', 'If you meet the above requirements, have the following skills and experience, and would like to join our dedicated team of childcare professionals, apply today.', 'Dental care', 'At Clever Daycare, we are always willing to go the extra mile to ensure children are cared for and on a positive path towards social, emotional, and academic development. We work with children from 9 months of age to 6 years of age and are a fully licensed and have accredited childcare centers in Calgary, as well as an accredited BBB company.', 'Must have a minimum of a CDA certification, preference is given for CDW, CDS.']"
