,Unnamed: 0,title,company,location,link,description,skills
9,9,Spécialiste en activités cliniques- Volet réadaptation pour le soutien à domicile SAD,CISSS de la Montérégie-Est,"Sorel-Tracy, QC, Canada, Quebec, Canada",https://ca.linkedin.com/jobs/view/sp%C3%A9cialiste-en-activit%C3%A9s-cliniques-volet-r%C3%A9adaptation-pour-le-soutien-%C3%A0-domicile-sad-at-cisss-de-la-mont%C3%A9r%C3%A9gie-est-3060104779?refId=f8z1eMnAgP1RlSLryKJjgQ%3D%3D&trackingId=wqbDMFjqMz7z2EU1ekKnsA%3D%3D&position=10&pageNum=0&trk=public_jobs_jserp-result_search-card,"
        <strong><u>Description<br><br></u></strong>Un emploi dans le secteur public dans le domaine de la santé, c’est avoir l’envie de servir et apporter vos compétences pour le bien de la population.<br><br>Avec ses 15 000 employés, la grande famille du CISSS de la Montérégie-Est est le plus grand employeur de la région et a cette mission à cœur en étant une organisation qui encourage l’engagement, la collaboration, et le bien-être de ses employés.<br><br>Vous y trouverez une équipe, de futurs collègues et amis ainsi que des opportunités d’emploi stimulantes et des possibilités d’évolution et de carrière.<br><br>Actuellement, le CISSS de la Montérégie-Est recrute un Spécialiste en activités cliniques pour un poste à temps complet de jour pour le soutien à domicile au CLSC Gaston-Bélanger à Sorel-Tracy.<br><br><strong><u>Responsabilités Du Spécialiste En Activités Cliniques<br></u></strong><ul><li>Participe à l'évaluation et à l'analyse des besoins des usagers, à l'élaboration des normes et standards de pratique professionnelle et à la recherche de solutions appropriées</li><li>Agit à titre de personne ressource et assure la supervision clinique des équipes de réadaptation pour la clientèle du soutien à domicile<br></li></ul>Les exigences liées à l’emploi du Spécialiste en activités cliniques:<br><ul><li> Doit détenir un diplôme universitaire dans une discipline appropriée soit en ergothérapie ou en physiothérapie</li><li> Membre en règle de son ordre professionnel</li><li> Automobile requise<br></li></ul><strong><u>Conditions D’emploi<br><br></u></strong>Un emploi à temps complet à Sorel-Tracy<br><br>4 semaines de vacances après un an de service<br><br>Salaire entre 27.08$ et 47.98$ / heure selon l'expérience<br><br>Un régime d'assurances collectives<br><br>Un régime de retraite<br><br>Des possibilités de développement et d’avancement<br><br>Une diversité des clientèles et des approches<br><br>Une équipe de travail compétente<br><br>Un emploi stimulant et stable dans des milieux structurés, chaleureux et dynamiques<br><br>De la formation et un encadrement continue<br><br>Intéressé par l’emploi à temps plein de Spécialiste en activités cliniques au CISSS de la Montérégie – Est à Sorel-Tracy ? Merci d’adresser votre candidature dans les meilleurs délais.<br><br>Ref : SAPA<br><br><strong><u>Exigences<br></u></strong><ul><li> Doit détenir un diplôme universitaire dans une discipline appropriée soit en ergothérapie ou en physiothérapie</li><li> Membre en règle de son ordre professionnel</li><li> Automobile requise<br></li></ul><strong><u>Remarques<br><br></u></strong>Nous remercions toutes les personnes qui poseront leur candidature, mais ne communiquerons qu’avec celles retenues pour une entrevue.<br><br>Le CISSS de la Montérégie-Est applique un programme d'accès à l'égalité en emploi et invite les Autochtones, les minorités visibles, les minorités ethniques, les femmes et les personnes handicapées à présenter leur candidature. Les personnes handicapées peuvent également nous faire part de leurs besoins particuliers relativement au processus de sélection pour l'emploi sollicité afin de faciliter l'étude de leur candidature.<br><br>L’emploi du masculin a pour but d’alléger la lecture du texte.
      ",[]
10,10,Child Care – Early Year’s Care Supervisor,Burnaby Neighbourhood House,"Burnaby, British Columbia, Canada",https://ca.linkedin.com/jobs/view/child-care-%E2%80%93-early-year%E2%80%99s-care-supervisor-at-burnaby-neighbourhood-house-3055607121?refId=f8z1eMnAgP1RlSLryKJjgQ%3D%3D&trackingId=MPecwkJdfDl9XCSP53%2BHyQ%3D%3D&position=11&pageNum=0&trk=public_jobs_jserp-result_search-card,"
        <strong><u>Description<br><br></u></strong>Un emploi dans le secteur public dans le domaine de la santé, c’est avoir l’envie de servir et apporter vos compétences pour le bien de la population.<br><br>Avec ses 15 000 employés, la grande famille du CISSS de la Montérégie-Est est le plus grand employeur de la région et a cette mission à cœur en étant une organisation qui encourage l’engagement, la collaboration, et le bien-être de ses employés.<br><br>Vous y trouverez une équipe, de futurs collègues et amis ainsi que des opportunités d’emploi stimulantes et des possibilités d’évolution et de carrière.<br><br>Actuellement, le CISSS de la Montérégie-Est recrute un Spécialiste en activités cliniques pour un poste à temps complet de jour pour le soutien à domicile au CLSC Gaston-Bélanger à Sorel-Tracy.<br><br><strong><u>Responsabilités Du Spécialiste En Activités Cliniques<br></u></strong><ul><li>Participe à l'évaluation et à l'analyse des besoins des usagers, à l'élaboration des normes et standards de pratique professionnelle et à la recherche de solutions appropriées</li><li>Agit à titre de personne ressource et assure la supervision clinique des équipes de réadaptation pour la clientèle du soutien à domicile<br></li></ul>Les exigences liées à l’emploi du Spécialiste en activités cliniques:<br><ul><li> Doit détenir un diplôme universitaire dans une discipline appropriée soit en ergothérapie ou en physiothérapie</li><li> Membre en règle de son ordre professionnel</li><li> Automobile requise<br></li></ul><strong><u>Conditions D’emploi<br><br></u></strong>Un emploi à temps complet à Sorel-Tracy<br><br>4 semaines de vacances après un an de service<br><br>Salaire entre 27.08$ et 47.98$ / heure selon l'expérience<br><br>Un régime d'assurances collectives<br><br>Un régime de retraite<br><br>Des possibilités de développement et d’avancement<br><br>Une diversité des clientèles et des approches<br><br>Une équipe de travail compétente<br><br>Un emploi stimulant et stable dans des milieux structurés, chaleureux et dynamiques<br><br>De la formation et un encadrement continue<br><br>Intéressé par l’emploi à temps plein de Spécialiste en activités cliniques au CISSS de la Montérégie – Est à Sorel-Tracy ? Merci d’adresser votre candidature dans les meilleurs délais.<br><br>Ref : SAPA<br><br><strong><u>Exigences<br></u></strong><ul><li> Doit détenir un diplôme universitaire dans une discipline appropriée soit en ergothérapie ou en physiothérapie</li><li> Membre en règle de son ordre professionnel</li><li> Automobile requise<br></li></ul><strong><u>Remarques<br><br></u></strong>Nous remercions toutes les personnes qui poseront leur candidature, mais ne communiquerons qu’avec celles retenues pour une entrevue.<br><br>Le CISSS de la Montérégie-Est applique un programme d'accès à l'égalité en emploi et invite les Autochtones, les minorités visibles, les minorités ethniques, les femmes et les personnes handicapées à présenter leur candidature. Les personnes handicapées peuvent également nous faire part de leurs besoins particuliers relativement au processus de sélection pour l'emploi sollicité afin de faciliter l'étude de leur candidature.<br><br>L’emploi du masculin a pour but d’alléger la lecture du texte.
      ",[]
11,11,ECE Early childhood Educator / Childcare,Lullaboo Nursery & Childcare Centre,"Bradford, Ontario, Canada",https://ca.linkedin.com/jobs/view/ece-early-childhood-educator-childcare-at-lullaboo-nursery-childcare-centre-3036501019?refId=f8z1eMnAgP1RlSLryKJjgQ%3D%3D&trackingId=B3lnA5eFDVg8KysF8xFOPQ%3D%3D&position=12&pageNum=0&trk=public_jobs_jserp-result_search-card,"
        <strong><u>Description<br><br></u></strong>Un emploi dans le secteur public dans le domaine de la santé, c’est avoir l’envie de servir et apporter vos compétences pour le bien de la population.<br><br>Avec ses 15 000 employés, la grande famille du CISSS de la Montérégie-Est est le plus grand employeur de la région et a cette mission à cœur en étant une organisation qui encourage l’engagement, la collaboration, et le bien-être de ses employés.<br><br>Vous y trouverez une équipe, de futurs collègues et amis ainsi que des opportunités d’emploi stimulantes et des possibilités d’évolution et de carrière.<br><br>Actuellement, le CISSS de la Montérégie-Est recrute un Spécialiste en activités cliniques pour un poste à temps complet de jour pour le soutien à domicile au CLSC Gaston-Bélanger à Sorel-Tracy.<br><br><strong><u>Responsabilités Du Spécialiste En Activités Cliniques<br></u></strong><ul><li>Participe à l'évaluation et à l'analyse des besoins des usagers, à l'élaboration des normes et standards de pratique professionnelle et à la recherche de solutions appropriées</li><li>Agit à titre de personne ressource et assure la supervision clinique des équipes de réadaptation pour la clientèle du soutien à domicile<br></li></ul>Les exigences liées à l’emploi du Spécialiste en activités cliniques:<br><ul><li> Doit détenir un diplôme universitaire dans une discipline appropriée soit en ergothérapie ou en physiothérapie</li><li> Membre en règle de son ordre professionnel</li><li> Automobile requise<br></li></ul><strong><u>Conditions D’emploi<br><br></u></strong>Un emploi à temps complet à Sorel-Tracy<br><br>4 semaines de vacances après un an de service<br><br>Salaire entre 27.08$ et 47.98$ / heure selon l'expérience<br><br>Un régime d'assurances collectives<br><br>Un régime de retraite<br><br>Des possibilités de développement et d’avancement<br><br>Une diversité des clientèles et des approches<br><br>Une équipe de travail compétente<br><br>Un emploi stimulant et stable dans des milieux structurés, chaleureux et dynamiques<br><br>De la formation et un encadrement continue<br><br>Intéressé par l’emploi à temps plein de Spécialiste en activités cliniques au CISSS de la Montérégie – Est à Sorel-Tracy ? Merci d’adresser votre candidature dans les meilleurs délais.<br><br>Ref : SAPA<br><br><strong><u>Exigences<br></u></strong><ul><li> Doit détenir un diplôme universitaire dans une discipline appropriée soit en ergothérapie ou en physiothérapie</li><li> Membre en règle de son ordre professionnel</li><li> Automobile requise<br></li></ul><strong><u>Remarques<br><br></u></strong>Nous remercions toutes les personnes qui poseront leur candidature, mais ne communiquerons qu’avec celles retenues pour une entrevue.<br><br>Le CISSS de la Montérégie-Est applique un programme d'accès à l'égalité en emploi et invite les Autochtones, les minorités visibles, les minorités ethniques, les femmes et les personnes handicapées à présenter leur candidature. Les personnes handicapées peuvent également nous faire part de leurs besoins particuliers relativement au processus de sélection pour l'emploi sollicité afin de faciliter l'étude de leur candidature.<br><br>L’emploi du masculin a pour but d’alléger la lecture du texte.
      ",[]
12,12,Child Care Centre Relief,Umbrella Family and Child Centres of Hamilton,"Hamilton, Ontario, Canada",https://ca.linkedin.com/jobs/view/child-care-centre-relief-at-umbrella-family-and-child-centres-of-hamilton-3056889853?refId=f8z1eMnAgP1RlSLryKJjgQ%3D%3D&trackingId=N5de7TbbGnAepZoWK9hoJQ%3D%3D&position=13&pageNum=0&trk=public_jobs_jserp-result_search-card,"
        For over 30 years, Umbrella Family and Child Centres of Hamilton has offered high-quality programs to young children and their families. We operate full-day early learning and childcare centres for infant, toddler and preschool children, as well as extended-day programs before and after school for kindergarten and school age children in over 30 locations throughout the Greater Hamilton Area.<br><br>We pride ourselves on being a leading childcare organization, committed to high quality programs that are inclusive, accessible, and promote learning and growth.<br><br><strong>Who are we Looking For?<br><br></strong>We are looking for a <strong>Child Care Centre</strong> <strong>Relief</strong> to compliment our team!<br><br>This is a unique position for Umbrella Family! The successful candidate will be used as relief, to cover staffing needs at any of our Umbrella Family locations. This role does not have a static schedule but provides a variety of shift and location coverage.<br><br>This position will be scheduled approximately 28.5 to 37.5 hours a week.<br><br><strong>Why work for Us?<br><br></strong>Benefits to Working for the Umbrella Family and Child Centres:<br><ul><li>Competitive wages and benefits </li><li>RRSP matching program </li><li>Employee Assistance Program</li><li>Unionized Environment</li><li>Generous vacation and sick time allotments</li><li>Employees with children get priority on childcare waiting list</li><li>Working in a fun, collaborative and positive environment with top professionals<br><br></li></ul><strong>What are we Looking For?<br><br></strong>To be considered for this role, the right candidate will have the following qualifications:<br><br><strong>Experience: </strong>Minimum 1-year experience working directly with children OR Related experience in a childcare setting, working with school age children<br><br><strong>Education:<br></strong><ul><li>Diploma in Early Childhood Education </li><li>We may consider those with the following Diploma: Child &amp; Youth Worker, OCT – Teacher, Education Assistant, Social Worker, Recreation &amp; Leisure <br><br></li></ul><strong>Certifications<br></strong><ul><li>Member in good standing with College of ECE’s</li><li>Standard First Aid with CPR level C</li><li>Satisfactory Vulnerable Sector Police Check</li><li>Proof of up to date immunization for TB, Tetanus and MMR</li><li>Proof of COVID-19 Vaccinations<br><br></li></ul><strong>Skills</strong>: Demonstrates awareness and knowledge of How Does Learning Happen is an asset<br><br><strong>Characteristics<br></strong><ul><li>Demonstrated ability to work independently and as part of a team in a fast paced environment</li><li>Flexible environment with minimal supervision</li><li>An advocate for diversity, equality, and inclusion<br><br></li></ul><strong>What will you be doing?<br><br></strong>You will be responsible for the ongoing operation of a high-quality childcare centre for children ages 12 months to 12 years of age.<br><br>The successful candidate will:<br><ul><li>Establish goals, plan, implement and evaluate developmentally appropriate experiences to enhance children’s cognitive, physical, social and emotional development in accordance with Ministry of Education’s How Does Learning Happen</li><li>Supervising children in your care at all times</li><li>Organize indoor and outdoor play areas, space, equipment, and materials to create a warm and welcoming environment</li><li>Conduct daily checks on each child in his/her group as per Ministry requirements, complete documentation and notify the Supervisor of any unusual circumstances</li><li>Maintain a safe, warm, and caring environment in which a high-quality child care program can operate, and maintain professional relationships with Hamilton Wentworth District School Board faculty</li><li>Work to provide age-appropriate developmental activities to enhance the individual and group’s cognitive, physical, social, cultural, and emotional development<br><br></li></ul><strong>Our Pandemic Response<br><br></strong>The health and safety of our employees is a top priority at Umbrella Family, using all necessary precautions with COVID-19 procedures. To protect our employees and potential employees, we have implemented:<br><ul><li>Remote interview process</li><li>PPE training and requirements for all employees</li><li>Active and passing screening at all childcare centres</li><li>Limiting access to only essential visitors</li><li>Enhanced cleaning measures at all locations<br><br></li></ul><em>In compliance with Accessibility for Ontarians with Disabilities Act, accommodations are available to applicants to support them in all aspects of the hiring process. Applicants need to make their needs known in advance. We thank all applicants but only those considered for an interview will be contacted</em>.<br><br>Powered by JazzHR<br><br>obJrvMBD2F
      ","['Establish goals, plan, implement and evaluate developmentally appropriate experiences to enhance children’s cognitive, physical, social and emotional development in accordance with Ministry of Education’s How Does Learning Happen', 'Organize indoor and outdoor play areas, space, equipment, and materials to create a warm and welcoming environment', 'Member in good standing with College of ECE’s', 'Enhanced cleaning measures at all locations', 'Competitive wages and benefits', 'Demonstrated ability to work independently and as part of a team in a fast paced environment', 'Conduct daily checks on each child in his/her group as per Ministry requirements, complete documentation and notify the Supervisor of any unusual circumstances', 'Flexible environment with minimal supervision', 'Generous vacation and sick time allotments', 'Supervising children in your care at all times', 'Remote interview process', 'Maintain a safe, warm, and caring environment in which a high-quality child care program can operate, and maintain professional relationships with Hamilton Wentworth District School Board faculty', 'Limiting access to only essential visitors', 'Active and passing screening at all childcare centres', 'Work to provide age-appropriate developmental activities to enhance the individual and group’s cognitive, physical, social, cultural, and emotional development', 'Working in a fun, collaborative and positive environment with top professionals']"
13,13,Banquet Houseman,Hilton,"Mississauga, Ontario, Canada",https://ca.linkedin.com/jobs/view/banquet-houseman-at-hilton-3059406557?refId=f8z1eMnAgP1RlSLryKJjgQ%3D%3D&trackingId=JUZf7NNp%2B9GnwCNLVUojkg%3D%3D&position=14&pageNum=0&trk=public_jobs_jserp-result_search-card,"
        A Houseman is responsible for supporting Food and Beverage operations to deliver an excellent Guest and Member experience while ensuring cleanliness of all areas and maintaining equipment.<br><br><strong>What will I be doing?<br><br></strong><strong><u>Responsibilities<br><br></u></strong>Specifically, you will be responsible for performing the following tasks to the highest standards<br><br>As a Houseman, you are responsible for supporting Food and Beverage operations to deliver an excellent Guest and Member experience. A Houseman will also be required to ensure cleanliness of all areas and maintain equipment.<br><ul><li>Maintain cleanliness of Food and Beverage areas</li><li>Ensure equipment is in full working order and report any defects</li><li>Project a professional manner to guests and team members</li><li>Assist back of house team when requested</li><li>Assist with set ups to ensure department runs efficiently</li><li>Manage the mis-en-place relating to Food and Beverage functions and special menus in a timely manner</li><li>Comply with hotel security, fire regulations and all health and safety legislation</li><li>Attend training provided by the hotel<br></li></ul><strong>What are we looking for?<br><br></strong><strong><u>Skills<br><br></u></strong>To successfully fill this role, you should maintain the attitude, behaviours, skills, and values that follow<br><br>A Houseman serving Hilton brands is always working on behalf of our Guests and working with other Team Members.<br><ul><li>Passion for delivering exceptional levels of guest service</li><li>Positive attitude</li><li>Good communication skills</li><li>Excellent grooming standards</li><li>Ability to work on your own or in teams<br></li></ul>It would be advantageous in this position for you to demonstrate the following capabilities and distinctions:<br><ul><li>Previous experience in hotel/leisure/retail sector<br></li></ul><strong>What will it be like to work for Hilton?<br><br></strong>Hilton is the leading global hospitality company, spanning the lodging sector from luxurious full-service hotels and resorts to extended-stay suites and mid-priced hotels. For nearly a century, Hilton has offered business and leisure travelers the finest in accommodations, service, amenities and value. Hilton is dedicated to continuing its tradition of providing exceptional guest experiences across its global brands. Our vision “to fill the earth with the light and warmth of hospitality” unites us as a team to create remarkable hospitality experiences around the world every day. And, our amazing Team Members are at the heart of it all!<br><br>Hilton Mississauga/Meadowvale welcomes and encourages applications from people with disabilities. Accommodations are available on request for candidates taking part in all aspects of the selection process. Hilton makes every effort to accommodate candidates with disabilities. For assistance, please contact us at <u>AODA_HILTONS_IN_CANADA@hilton.com</u> anytime, or call 1-844-217-AODA Monday through Friday, 9:00am - 5:00pm EST.<br><br><strong>Work Locations<br><br></strong>Hilton Mississauga Meadowvale<br><br><strong>Schedule<br><br></strong>Part-time<br><br><strong>Brand<br><br></strong>Hilton Hotels &amp; Resorts<br><br><strong>Shift<br><br></strong>Full Availability<br><br><strong>Job Level<br><br></strong>Team Member<br><br><strong>Job<br><br></strong>Banquets
      ","['Positive attitude', 'Good communication skills', 'Excellent grooming standards', 'Attend training provided by the hotel', 'Previous experience in hotel/leisure/retail sector', 'Assist with set ups to ensure department runs efficiently', 'Manage the mis-en-place relating to Food and Beverage functions and special menus in a timely manner', 'Comply with hotel security, fire regulations and all health and safety legislation', 'Project a professional manner to guests and team members', 'Ensure equipment is in full working order and report any defects', 'Maintain cleanliness of Food and Beverage areas', 'Assist back of house team when requested']"
