,Unnamed: 0,title,company,location,link,description,skills
5,5,Extrusion Operator,Kaycan,"Brampton, ON",https://www.monster.ca/job-openings/extrusion-operator-brampton-08--4cfd0be5-72a7-4cef-be0b-0c3fdc2b57ef?sid=7affa032-6daf-4ecf-91c7-f7f493b56447&jvo=m.go.sc.6&_ga=2.131341455.1277025919.1651864384-1420397846.1651864384&hidesmr=1,"<section class=""cached-bot-fjv-skeletonstyle__CachedSkeletonDescription-sc-gqtazs-0 gbrdjA""><p>Join KP Building Products’ Production team in Brampton, ON.</p><p><strong>What’s in it for YOU?<br/></strong><em>Want to advance in your career and earn more? Would you enjoy a direct hire, full time opportunity that offers 3-4 days off a week? Earn more as you learn more in this career with a stable organization that will invest in your future, helping you advance and increase your value.</em></p><p>KP Building Products, a member of the Kaycan Group of companies, is seeking <strong>Extrusion Operators</strong> of all levels to join our continental shift teams in our Brampton, Ontario facility.</p><p>If you have production, warehouse, construction or related experience, this is a career you need to explore.</p><p><strong>Shifts:</strong> 12h continental shifts / Rotating every 2 weeks – Day and Night<br/><strong>Salary starting at:</strong> $18.00 per hour</p><p><strong>We offer: </strong></p><ul><li> Health and Dental benefits</li><li> RRSP</li><li> Ongoing training initiatives</li><li> Yearly Safety Boot Allowance</li><li> Prescription Safety Glasses Allowance</li><li> Vacation &amp; paid time off</li></ul><p><strong>Responsibilities:</strong></p><ul><li> Ensure all lines are running without quality concerns at the beginning and throughout your shift</li><li> Keep in contact, if need arises, with Lead Hand Operator, Packer and Production Supervisor when changes occur. (eg. colour changes, scrapping, etc.)</li><li> Help other operators when needed</li><li> Make all quality checks as required. Finished products must match all quality standards assigned. (eg. Cosmetic, Functional, and Appearance etc.)</li><li> Assist in line changeovers including die removal and replacement</li><li> Maintain housekeeping of your lines and workstation</li><li> Light maintenance, minor repairs and adjustments to correct extrusion problems</li><li> Operator extrusion, downtime tracking and running sheets are completed</li><li> Packer relief as needed</li><li> Follow any reasonable request from a Supervisor</li><li> Follow KP Building's ISO quality management system</li><li> Participate in training as required by the company</li><li> Adhere to all applicable company policies and procedures, including quality and health and safety</li></ul><p><strong>Qualifications:</strong></p><ul><li> Competed high school diploma, GED, or equivalent</li><li> One (1) year experience as an extrusion operator within a manufacturing environment, preferably plastics extrusion is an asset</li><li> Machine Operator experience an asset and willing to learn</li><li> Ability to lift up to 50 lbs</li><li> Mechanically inclined and willing to learn</li></ul><p>We thank all candidates for their interest, however only those candidates who meet the requirements of the role will be contacted.</p><p><em>KP Products is committed to creating a diverse environment and is proud to be an equal opportunity employer. Upon request, KP Products will provide reasonable accommodation for disabilities to support participation of candidates in all aspects of the recruitment process.</em></p></section>","['Join KP Building Products’ Production team in Brampton, ON.', 'Competed high school diploma, GED, or equivalent', 'What’s in it for YOU?Want to advance in your career and earn more? Would you enjoy a direct hire, full time opportunity that offers 3-4 days off a week? Earn more as you learn more in this career with a stable organization that will invest in your future, helping you advance and increase your value.', 'Shifts: 12h continental shifts / Rotating every 2 weeks – Day and NightSalary starting at: $18.00 per hour', 'If you have production, warehouse, construction or related experience, this is a career you need to explore.', 'Ongoing training initiatives', 'Maintain housekeeping of your lines and workstation', 'Help other operators when needed', 'Machine Operator experience an asset and willing to learn', 'Make all quality checks as required. Finished products must match all quality standards assigned. (eg. Cosmetic, Functional, and Appearance etc.)', 'Health and Dental benefits', 'Follow any reasonable request from a Supervisor', 'Mechanically inclined and willing to learn', 'Keep in contact, if need arises, with Lead Hand Operator, Packer and Production Supervisor when changes occur. (eg. colour changes, scrapping, etc.)', 'One (1) year experience as an extrusion operator within a manufacturing environment, preferably plastics extrusion is an asset']"
6,6,Back- Up Extrusion Operator - Food Processing,Grand River Foods,"Cambridge, ON",https://www.monster.ca/job-openings/back-up-extrusion-operator-food-processing-cambridge-08--93fa2d63-132b-4888-9717-07476f708d07?sid=7affa032-6daf-4ecf-91c7-f7f493b56447&jvo=m.go.sc.7&_ga=2.131341455.1277025919.1651864384-1420397846.1651864384&hidesmr=1,"<section class=""cached-bot-fjv-skeletonstyle__CachedSkeletonDescription-sc-gqtazs-0 gbrdjA""><p><b>The Company:</b>Grand River Foods is a leading food solutions company serving customers in the North American grocery and food service industry. As a member of the Sunrise Farm family, we remain as dedicated as ever to both providing a quality work environment for our employees, as well as producing only the highest quality products for our customers. We are known for the great care we take with clients and employees alike.</p><p><b>The Location:</b> Grand River Foods is based in Cambridge, Ontario. Our location is commutable from a number of cities in the region: Kitchener, Waterloo, Brantford, Guelph, and more. For those living in Cambridge, our facility is located nearby a number of GRT transit stops. </p><p>GRF is currently seeking a back-up operator for the Extrusion on on the afternoon shift. </p><p><u>Afternoon shift:</u> start times varying between 1:30pm and 2:30pm, 9 hours shifts Monday to Friday with some overtime required on weekends.</p><p style=""margin-bottom:12pt"">GRF operates in a fast-paced, and physical environment. Applicants must be comfortable handling plant-based protein products (soy and pea) and must be comfortable with 20-40 pounds of repetitive lifting. We are currently seeking candidates who have experience with machine operation in a food processing facility.</p><p style=""margin-bottom:12pt""><b>Responsibilities:</b></p><ul><li>Equipment setup, assembly/disassembly and operation</li><li>Utilization of specific production tools and equipment</li><li>Ability to troubleshoot mechanical problems</li><li>Accurately document production results</li><li>Adherence to strict operating procedures and food safety guidelines</li><li>Strong attention to detail</li><li>Regularly inspect work environment for good housekeeping</li><li>Communicate effectively with Team Leaders and other employees</li><li>Manually pack product into bags, cartons or other containers</li><li>Remove finished goods cartons from conveyor and place on pallets</li><li>Spread products after the extruder for evenness &amp; look for foreign material</li><li>Inspect and sort products and packages that do not meet specified standards</li><li>Lifting, dumping and stacking 10-40 lbs. boxes of product</li><li>Pushing 200-500 lbs. bins from blending area to production line (bins are on wheels)</li><li>Regularly inspect work environment for good housekeeping</li><li>Repetitive tasks and standing in one spot for extended periods of time</li><li>Must wear all Personal Protective Equipment (PPE) supplied</li><li>Other relevant duties as assigned</li></ul><p><b>Requirements:</b></p><ul><li>Experience with machine operation in a <i>food processing environment</i></li><li>Legally eligible to work in Canada</li><li>Able to communicate effectively with teammates and leadership</li><li>Ability to work with minimal supervision and in a team environment</li><li>18 years of age or older</li><li>Good attendance record required</li><li>A positive attitude and willing to develop new skills</li><li>Comfortable working around plant-based proteins (handling using gloves, smells, etc).</li><li>Previous food industry experience including GMPs and basic food handling are assets</li></ul><p><b>Benefits:</b></p><ul><li>Comprehensive benefits after three-month probation</li><li>Option to participate in GRF Pension Program after three-month probation</li><li>Opportunity for advancement</li><li>Product can be purchased at a reduced cost</li><li>All company PPE provided</li></ul><p><b>Apply Now!</b><br/><br/>Grand River Foods (Cambridge) embraces diversity and is committed to creating an inclusive workplace. Grand River Foods (Cambridge) is dedicated to attracting, development and retaining talented employees from diverse backgrounds, allowing us to benefit from a wide variety of experiences and perspectives. In accordance with the Accessibility for Ontarians with Disabilities Act (AODA), 2005, under the Human Rights Code accommodation will be provided at any point throughout the recruitment process, the candidate will need to make their accommodation need known to the HR Department.</p></section>","['Lifting, dumping and stacking 10-40 lbs. boxes of product', 'Accurately document production results', 'Repetitive tasks and standing in one spot for extended periods of time', 'Must wear all Personal Protective Equipment (PPE) supplied', 'Able to communicate effectively with teammates and leadership', 'Inspect and sort products and packages that do not meet specified standards', 'Strong attention to detail', 'Other relevant duties as assigned', 'GRF operates in a fast-paced, and physical environment. Applicants must be comfortable handling plant-based protein products (soy\xa0and pea) and must be comfortable with 20-40 pounds of repetitive lifting. We are currently seeking candidates who have experience with machine operation in a food processing facility.', '18 years of age or older', 'Remove finished goods cartons from conveyor and place on pallets', 'Comprehensive benefits after three-month probation', 'Manually pack product into bags, cartons or other containers', 'Regularly inspect work environment for good housekeeping', 'Spread products after the extruder for evenness & look for foreign material', 'Good attendance record required', 'Pushing 200-500 lbs. bins from blending area to production line (bins are on wheels)', 'Experience with machine operation in a food processing environment', 'The Company:Grand River Foods is a leading food solutions company serving customers in the North American grocery and food service industry. As a member of the Sunrise Farm family, we remain as dedicated as ever to both providing a quality work environment for our employees, as well as producing only the highest quality products for our customers. We are known for the great care we take with clients and employees alike.', 'Previous food industry experience including GMPs and basic food handling are assets', 'Legally eligible to work in Canada', 'Comfortable working around plant-based proteins (handling using gloves, smells, etc).']"
7,7,"Extruder Operator - $3,000 Sign On Bonus",Mars Incorporated,"Guelph, ON",https://www.monster.ca/job-openings/extruder-operator-3-000-sign-on-bonus-guelph-08--b08e40a6-7b48-4cf5-b43d-1a410f0d20db?sid=7affa032-6daf-4ecf-91c7-f7f493b56447&jvo=m.go.sc.8&_ga=2.131341455.1277025919.1651864384-1420397846.1651864384&hidesmr=1,"<section class=""cached-bot-fjv-skeletonstyle__CachedSkeletonDescription-sc-gqtazs-0 gbrdjA"">Hours: 12 hours shifts - Day: 7am-7pm; Night: 7pm-7am. <p> Shift Rotation: Day shift: 2 on, 2 off, 3 on, 2 off, 2 on, 3 off -Repeat but on night shift. </p><p> This is a 2 week rotation. </p><p><b> This position is eligible to receive a $3,000 sign-on bonus, broken into 2 payments of $1,500 to be paid at six and twelve months. </b></p><p> Job Summary </p><p> Perform and report extrusion operations in order to comply with safety, quality and productivity targets</p><p>Essential Duties (Responsibilities) </p><p> All PPE must be worn in compliance with the OHSA/RC requirements<br/>Enforce/Respect the safety rules and the internal policy<br/>Stop any equipment / operative works / external company works if safety/environment protection/fire protection rules are broken<br/>Guarantee and apply ISO 14001 (Environment), and all related working procedures<br/>Ownership of environmental responsibilities listed in ENV-REF-002 - Associates SEA Matrix<br/>Guarantee and apply ISO 9001, FSS/ISO22000, Mars Standards, and all related working procedures<br/>Support the HACCP program in the department<br/>Follow GMP-GHP in the area<br/>Inform Shift Supervisor of quality deviations according to product standards and production procedures<br/>Maintain CCPs and oPrPs in the department<br/>Perform the CCP and oPrP's procedure according to SOPs<br/>Sampling of products to ensure quality control (micro sampling)<br/>Report any pest activity to related Manager<br/>Perform and record quality control tests<br/>Adhere to multi-skills policy and acquire at least one additional competence as established with and by Management<br/>Training: attend any training program as scheduled by company management and train any designed person in the position<br/>Perform extruding line start up sequence processes<br/>Run the extruding processes<br/>Perform extruding line shut down sequence processes<br/>Assign FP silos and instruct packaging operator<br/>Control and maintain a constant supply of coating powders and liquids to the coater in cooperation with the RM handler<br/>Perform area-related equipment first level maintenance<br/>Perform inventory of raw ingredients / packaging materials / finished products in bins, silos and racks (cyclical and period end inventories)<br/>Any task as delegated by Manager<br/>Perform Housekeeping Checks to ensure compliance to 5S<br/>Perform operational cleaning operations<br/>Change ver cleaning<br/>Weekly cleaning &amp; Sanitatin<br/>Hyp cleaning<br/>Provide any requested documentation to other Departments according to internal rules<br/>Shift changes: communicate with co-worker of next shift about machine problems, progress on production schedule, bin inventories, quality issue...<br/>Complete production reports as required by manager and record any production events (stops, quantity, quality...)</p><p>BACKGROUND EXPERIENCE &amp; QUALIFICATIONS </p><p> Training and/or experience in functional tasks (opt: knowledge of feed/food industry)<br/>Must be willing to work irregular hours and extended shift if necessary<br/>Safety &amp; Hygiene &amp; Quality conscious, Initiative, Self motivated, Team player, Technically inclined, Depth perception, Tolerance to hot environment, Unrestricted range of motion, Color discrimination, olfactory and texture perception

 <a href=""https://ars2.equest.com/?response_id=1fc75f8fed67357327bdf47a49bd910c"" rel=""nofollow""></a></p></section>","['Training and/or experience in functional tasks (opt: knowledge of feed/food industry)Must be willing to work irregular hours and extended shift if necessarySafety & Hygiene & Quality conscious, Initiative, Self motivated, Team player, Technically inclined, Depth perception, Tolerance to hot environment, Unrestricted range of motion, Color discrimination, olfactory and texture perception', 'BACKGROUND EXPERIENCE & QUALIFICATIONS']"
8,8,Progressive Set-Up / Operator,HCR,"Vaughan, ON",https://www.monster.ca/job-openings/progressive-set-up-operator-vaughan-08--768f77c5-9845-40a5-b8a8-d57c6563525c?sid=7affa032-6daf-4ecf-91c7-f7f493b56447&jvo=m.go.sc.9&_ga=2.131341455.1277025919.1651864384-1420397846.1651864384&hidesmr=1,"<section class=""cached-bot-fjv-skeletonstyle__CachedSkeletonDescription-sc-gqtazs-0 gbrdjA""><table border=""0""><tbody><tr><td><b>Posted Date:</b></td><td>4/28/2022</td></tr><tr><td><b>Job Category:</b></td><td></td></tr><tr><td><b>Position Title:</b></td><td>Progressive Set-Up / Operator</td></tr><tr><td><b>Salary Range:</b></td><td>$25.00 - $30.00</td></tr><tr><td><b>Location:</b></td><td>Vaughan, Ontario, Canada<br/></td></tr><tr><td><b>Desired Skills:</b></td><td><table></table></td></tr><tr><td><b>Description:</b></td><td>Our client, a global world class manufacturer in the Vaughan area, is currently recruiting for a Progressive Set-up / operator. <br/><br/>WHAT'S IN IT FOR YOU: <br/>Opportunity to work for a very well respected, world class manufacturer that has enjoyed many years of success and stability.<br/>Paid additional training and development.<br/>Excellent growth and advancement opportunities.<br/>An excellent compensation package including:<br/>- Competitive salary<br/>- Excellent benefits<br/>- RRSP matching<br/>- Profit sharing<br/><br/>Minimum qualifications:<br/>- 3 years experience as a Progressive Press Set-Up Operator<br/>- Must have knowledge of First and Last Off Procedure<br/>- Must have knowledge of loading, unloading and storing of tooling equipment in appropriate area<br/>- Knowledge of press controls and tooling protection or other pieces of equipment to run a press<br/>- Valid forklift license and ability to operate 6000 lb. to 12000 lb. lift trucks<br/>- Must have knowledge to set all tooling for all presses<br/>- Must have knowledge of operating presses for both manual and progressive dies<br/>- Must have knowledge of all Inspection Records, SPC Charts and checking fixtures<br/>- Must have knowledge of measuring equipment, such as; micrometer and vernier, caliper <br/><br/>Responsibilities include:<br/>- Ensure that at all times prior to set–up, safety checklist is followed, completed and recorded<br/>- Must be able to organize, properly prepare and have foresight to be fully equipped to set-up utilizing a quick die change system<br/>- Ability to follow written set-up instructions and fill out proper set-up papers<br/>- Ability to operate safely 10 to 40 ton cranes with appropriate sling or chain. Must have training certificate<br/>- Must have knowledge to properly set counter balance air according to tool weight<br/>- Ability to load coils on uncoilers, preparation for use, and start strip through die<br/><br/>Contact and Resume Submission<br/>If you feel you are an excellent candidate and have the required skills and experience indicated above, please send your attached resume and any important details to HCR Permanent Search, care of the Recruitment Consultant listed below. Only qualified candidates who can work in Canada without restriction will be contacted. <br/><br/><br/>Dennis Bossé<br/>Director of Operations<br/>HCR Permanent Search<br/>(905) 669-2400 x2236<br/>Email: dbosse@hcr.ca<br/>www.hcrpermsearch.com</td></tr></tbody></table></section>",[]
9,9,Extrusion Operator,Kaycan,"Milton, ON",https://www.monster.ca/job-openings/extrusion-operator-milton-08--647a19e2-d926-424f-9215-e22590ac8def?sid=7affa032-6daf-4ecf-91c7-f7f493b56447&jvo=m.go.sc.10&_ga=2.131341455.1277025919.1651864384-1420397846.1651864384&hidesmr=1,"<section class=""cached-bot-fjv-skeletonstyle__CachedSkeletonDescription-sc-gqtazs-0 gbrdjA""><p><strong><em>Want to advance in your career and earn more?</em></strong><br/><strong>Join a stable organization that will invest in your future, helping you advance and increase your value!</strong></p><p><strong>KP Building Products</strong>, a member of the Kaycan Group of companies is seeking <strong>Extrusion Operators</strong> of all levels to join our teams at our Brampton facility. If you have <strong>production, warehouse, construction or related experience</strong>, this is a career you need to explore.</p><p><strong>Schedule: </strong>Continental shifts - 3-2-2-3 / 12-hour<br/><strong>Salary starting at: $18/h</strong></p><p><strong>We offer :</strong></p><ul><li>Dental, Medical, Life and Disability insurance plan</li><li>RRSP plan</li><li>Pension Plan</li><li>Ongoing training initiatives</li><li>Opportunities for growth &amp; development;</li></ul><p><strong>Responsibilities:</strong></p><ul><li>Ensure production goals are met and works closely with the production and quality teams to ensure the product is to the quality standards</li><li>Ensure all lines are running without quality concerns at the beginning and throughout your shift</li><li>Keep in contact, if need arises, with Lead Hand Operator, Packer and Production Supervisor when changes occur. (eg. colour changes, scrapping, etc.)</li><li>Help other operators when needed</li><li>Make all quality checks as required. Finished products must match all quality standards assigned. (eg. Cosmetic, Functional, and Appearance etc.)</li><li>Assist in line changeovers including die removal and replacement</li><li>Maintain housekeeping of your lines and workstation</li><li>Light maintenance, minor repairs and adjustments to correct extrusion problems</li><li>Operator extrusion, downtime tracking and running sheets are completed</li><li>Packer relief as needed</li><li>Follow any reasonable request from a Supervisor</li><li>Follow KP Building's ISO quality management system</li><li>Participate in training as required by the company</li><li>Adhere to all applicable company policies and procedures, including quality and health and safety</li></ul><p><strong>Qualifications:</strong></p><ul><li>Completed high school diploma, GED, or equivalent</li><li>One (1) year experience as an extrusion operator within a manufacturing environment</li><li>Experience in plastics extrusion - an asset</li><li><strong>Working Conditions</strong></li></ul><ul><li>Ability to work 12-hour continental shifts. (42 hours a week)</li><li>Safety glasses and boots are required throughout the plant; PPE as required</li><li>Ability to lift up to 50 lbs</li></ul><p>We thank all candidates for their interest, however only those candidates who meet the requirements of the role will be contacted.</p><p><em>KP Products is committed to creating a diverse environment and is proud to be an equal opportunity employer. Upon request, KP Products will provide reasonable accommodation for disabilities to support participation of candidates in all aspects of the recruitment process.</em></p></section>","[""Follow KP Building's ISO quality management system"", 'Want to advance in your career and earn more?Join a stable organization that will invest in your future, helping you advance and increase your value!', 'Ensure all lines are running without quality concerns at the beginning and throughout your shift', 'One (1) year experience as an extrusion operator within a manufacturing environment', 'Ongoing training initiatives', 'Ensure production goals are met and works closely with the production and quality teams to ensure the product is to the quality standards', 'Help other operators when needed', 'Maintain housekeeping of your lines and workstation', 'Adhere to all applicable company policies and procedures, including quality and health and safety', 'Experience in plastics extrusion - an asset', 'Participate in training as required by the company', 'KP Building Products, a member of the Kaycan Group of companies is seeking Extrusion Operators of all levels to join our teams at our Brampton facility. If you have production, warehouse, construction or related experience, this is a career you need to explore.', 'Make all quality checks as required. Finished products must match all quality standards assigned. (eg. Cosmetic, Functional, and Appearance etc.)', 'Assist in line changeovers including die removal and replacement', 'Follow any reasonable request from a Supervisor', 'Keep in contact, if need arises, with Lead Hand Operator, Packer and Production Supervisor when changes occur. (eg. colour changes, scrapping, etc.)', 'Completed high school diploma, GED, or equivalent', 'Light maintenance, minor repairs and adjustments to correct extrusion problems']"
