,Unnamed: 0,title,company,location,link,description,skills
10,10,Press Set-Up Operator - Afternoons,Magna,"Woodbridge, MB",https://www.monster.ca/job-openings/press-set-up-operator-afternoons-woodbridge-08--d34aa5d1-6a5a-4817-8fe0-729847bdb54b?sid=7affa032-6daf-4ecf-91c7-f7f493b56447&jvo=m.go.sc.11&_ga=2.131341455.1277025919.1651864384-1420397846.1651864384&hidesmr=1,"<section class=""cached-bot-fjv-skeletonstyle__CachedSkeletonDescription-sc-gqtazs-0 gbrdjA""><div><p></p><p> </p><p style=""margin-left:10px;text-align:justify""> </p><p style=""text-align:justify""><b>Job Number:</b> 40812 <br/><b>Group:</b> Magna Exteriors  <br/><b>Division</b>: Mytox Mfg. <br/><b>Job Type:</b> Permanent/Regular <br/><b>Location:</b> Woodbridge </p><p style=""text-align:justify""> </p><p style=""text-align:justify""><b>Group Description</b></p><p style=""text-align:justify"">The Magna Exteriors portfolio of products includes access systems such as liftgates, exterior trim, modular systems, front-end modules including fascia, active aerodynamic systems and other lightweight structural components for automotive, commercial truck and other industrial markets.</p><p style=""text-align:justify"">Recognized globally as an innovator in all aspects of vehicle exteriors, Magna provides everything needed, from materials development and design through manufacturing and assembly, to help automakers create sleek, state-of-the-art vehicles across the world.</p><p> </p><div><div style=""padding:10px 0px;border:1px solid transparent""><div style=""font-size:16px;word-wrap:break-word""><h2 style=""font-size:1em;margin:0px""><b>QUALIFICATIONS NECESSARY TO DO THE JOB:</b></h2></div><div><p>•    Ensure that at all times prior to set–up, safety checklist is followed, completed and recorded<br/>•    Must have knowledge of First and Last Off  Procedure<br/>•    Must have knowledge of loading, unloading and storing of tooling equipment in appropriate safety area<br/>•    Must have knowledge to set all tooling for all presses<br/>•    Must have knowledge of operating presses  for both  manual and  progressive dies<br/>•    Must have knowledge of all Inspection Records,  SPC Charts and checking fixtures<br/>•    Must have knowledge of measuring equipment, such as; micrometer and  vernier, and caliper <br/>•    Must be able to organize,  properly prepare  and have foresight to be fully equipped to set-up  <br/>utilizing a quick die change system<br/>•    Must have experience in starting and shutting down of all equipment necessary to run appropriate press<br/>•    Knowledge on how to inspect press and tooling at the beginning of the shift<br/>•    Good English (both written and verbal) communication skills<br/>•    Basic Mathematical skills<br/>•    Must be able to work overtime when required and willing to help out when necessary as per customer demands</p></div></div><div style=""padding:10px 0px;border:1px solid transparent""><div style=""font-size:16px;word-wrap:break-word""><h2 style=""font-size:1em;margin:0px""><b>DESIRABLE ADDITIONAL QUALIFICATIONS:</b></h2></div><div><p>•    Valid forklift license and ability to operate 6000 lb. to 12000 lb. lift trucks<br/>•    Ability to follow written set-up instructions and fill out proper set-up papers/maintain tool work order</p></div></div><div style=""padding:10px 0px;border:1px solid transparent""><div style=""font-size:16px;word-wrap:break-word""><h2 style=""font-size:1em;margin:0px""><b>MAIN DUTIES AND ACTIVITIES OF JOB:</b></h2></div><div><p>•    Knowledge  of press controls and tooling protection or other pieces of equipment to run a press<br/>•    Must be able to communicate issues/problems to area leader<br/>•    Ability to order or to have in stock all necessary equipment and parts required for quick die change<br/>•    Must be able to coordinate with other departments i.e. maintenance, toolroom, etc.<br/>•    Must be able to maintain operation of “two” simultaneously running presses<br/>•    Must be  able to keep “one” press cycling while doing set-up on the other press<br/>•    Must be able to communicate with area leader, maintenance, toolroom , etc. concerning any problems/requirements affecting operation of two presses, tooling problem solving<br/>•    Knowledge of how to use die cart and die tables<br/>•    Ability to operate safely 10 to 40 ton cranes with appropriate sling or chain. Must have training certificate<br/>•    Must have knowledge to properly set  counter balance air according to tool weight<br/>•    Experience in tooling set-up with roll feeders and die protection<br/>•    Ability to load coils on uncoilers, preparation for use, and start strip through  die<br/>•    Ability to input production data into the system and follow required schedule<br/>•    Able to complete a Forklift Safety checklist<br/>•    Must be organized  and clean up before and after set-up, including moping of the floor<br/>•    Knowledge of WHMIS/GHS<br/>•    Good organizational skills, ability to work well without supervision<br/>•    Attend training based on Mytox Internal Training Matric<br/>•    Utilize effective Housekeeping Practices<br/>•    Adhere to all safety rules and regulations as outlined in the Mytox Employee Handbook<br/>•    Follows all applicable Mytox BOS procedures<br/>•    Any other reasonable request made by Management </p></div></div><div style=""padding:10px 0px;border:1px solid transparent""><div style=""font-size:16px;word-wrap:break-word""><h2 style=""font-size:1em;margin:0px""><b>Additional Information</b></h2></div><div><p>Accommodations for disabilities in relation to the job selection process are available upon request.</p></div></div></div><p style=""margin-left:10px;text-align:justify"">07--Operations F--Permanent/Regular </p></div></section>","['Recognized globally as an innovator in all aspects of vehicle exteriors, Magna provides everything needed, from materials development and design through manufacturing and assembly, to help automakers create sleek, state-of-the-art vehicles across the world.', '•\xa0\xa0 \xa0Valid forklift license and ability to operate 6000 lb. to 12000 lb. lift trucks•\xa0\xa0 \xa0Ability to follow written set-up instructions and fill out proper set-up papers/maintain tool work order']"
11,11,Extruder Operator,Mars Incorporated,"Bolton, ON",https://www.monster.ca/job-openings/extruder-operator-bolton-08--f3ba20e7-977c-4a21-95bb-c3af6236dbc2?sid=7affa032-6daf-4ecf-91c7-f7f493b56447&jvo=m.go.sc.12&_ga=2.131341455.1277025919.1651864384-1420397846.1651864384&hidesmr=1,"<section class=""cached-bot-fjv-skeletonstyle__CachedSkeletonDescription-sc-gqtazs-0 gbrdjA""><b> Job Summary </b><p> Extrusion Operators are system experts in their assigned area, and are highly functional in multiple areas. Extrusion Operators must also ensure efficiency, operational conformance, product quality and continuous improvement. Extrusion Operators function as a member of an area team which is directly responsible for the efficient production of quality products in the required quantities. They operate/change over specified machinery in the assigned area in the prescribed amount of time. Extrusion Operators must have the skill set to perform the tasks of other associates in the area as needed. This job requires Strong Communication, Interpersonal and Team Building skills to support site objectives </p><p><b> Key Accountabilities </b></p><p> • Responsible for the basic/routine running of packaging/process equipment to complete the conversion process and package finishe d product prior to shipping in accordance with all routine SOPs and specifications </p><p> • Loading of packaging material/raw material </p><p> • Clearing jams/troubleshooting process issues </p><p> • Resetting faults </p><p> • Product changeovers </p><p> • Product quality checks and report issues to Technical Operator </p><p> • Maintaining area GMP's </p><p> • Complete basic preventative maintenance work orders as assigned (e.g. lubrication, observation, CILs etc) and enter corrective work order requests into the MIS </p><p> • Active participation in the Safety program as it applies to the Process/Packaging Area, including area audits and conformance to all area LOTO and safety procedures </p><p> • Responsible for following all Quality and Food Safety Policies and applicable procedures </p><p><b> Quality and Food Safety </b></p><p>Utilizing knowledge of Q/FS systems the associate ensures Food Safety requirements are effectively performed. This includes training of other associates on the Food Safety &amp; Hazard Analysis Critical Control Points (HACCP), ensuring CCP monitoring is in effect and continuous improvement of the process with any changes to our working environment is practiced. </p><p><b> Key Technical Knowledge and Skills </b></p><p> • Mechanical aptitude </p><p> • Basic troubleshooting skills </p><p> • SPC </p><p> • Safety &amp; safe work practices </p><p> • Knowledge of food safety, GMP's, ISO, HACCP </p><p><b> Critical Learning Experiences </b></p><p>• Operational experience </p><p> • Packaging and process experience

 <a href=""https://ars2.equest.com/?response_id=cd0ba721eda459d728019d1dd514943e"" rel=""nofollow""></a></p></section>","['• Active participation in the Safety program as it applies to the Process/Packaging Area, including area audits and conformance to all area LOTO and safety procedures', '• Operational experience', '• Complete basic preventative maintenance work orders as assigned (e.g. lubrication, observation, CILs etc) and enter corrective work order requests into the MIS', '• Basic troubleshooting skills', '• Packaging and process experience', '• Responsible for following all Quality and Food Safety Policies and applicable procedures', ""• Maintaining area GMP's"", 'Utilizing knowledge of Q/FS systems the associate ensures Food Safety requirements are effectively performed. This includes training of other associates on the Food Safety & Hazard Analysis Critical Control Points (HACCP), ensuring CCP monitoring is in effect and continuous improvement of the process with any changes to our working environment is practiced.', '• Responsible for the basic/routine running of packaging/process equipment to complete the conversion process and package finishe d product prior to shipping in accordance with all routine SOPs and specifications']"
12,12,Extrusion Operator,Kaycan,"ON, ON",https://www.monster.ca/job-openings/extrusion-operator--4c439796-124c-42fd-9f0c-f00e6f5dff6d?sid=7affa032-6daf-4ecf-91c7-f7f493b56447&jvo=m.go.sc.13&_ga=2.131341455.1277025919.1651864384-1420397846.1651864384&hidesmr=1,"<section class=""cached-bot-fjv-skeletonstyle__CachedSkeletonDescription-sc-gqtazs-0 gbrdjA""><p>Join KP Building Products' Production team in Brampton, ON.</p><p><strong>What's in it for YOU?<br/></strong><em>Want to advance in your career and earn more? Would you enjoy a direct hire, full time opportunity that offers 3-4 days off a week? Earn more as you learn more in this career with a stable organization that will invest in your future, helping you advance and increase your value.</em></p><p>KP Building Products, a member of the Kaycan Group of companies, is seeking <strong>Extrusion Operators</strong> of all levels to join our continental shift teams in our Brampton, Ontario facility.</p><p>If you have production, warehouse, construction or related experience, this is a career you need to explore.</p><p><strong>Shifts:</strong> 12h continental shifts / Rotating every 2 weeks – Day and Night<br/><strong>Salary starting at:</strong> $18.00 per hour</p><p><strong>We offer: </strong></p><ul><li> Health and Dental benefits</li><li> RRSP</li><li> Ongoing training initiatives</li><li> Yearly Safety Boot Allowance</li><li> Prescription Safety Glasses Allowance</li><li> Vacation &amp; paid time off</li></ul><p><strong>Responsibilities:</strong></p><ul><li> Ensure all lines are running without quality concerns at the beginning and throughout your shift</li><li> Keep in contact, if need arises, with Lead Hand Operator, Packer and Production Supervisor when changes occur. (eg. colour changes, scrapping, etc.)</li><li> Help other operators when needed</li><li> Make all quality checks as required. Finished products must match all quality standards assigned. (eg. Cosmetic, Functional, and Appearance etc.)</li><li> Assist in line changeovers including die removal and replacement</li><li> Maintain housekeeping of your lines and workstation</li><li> Light maintenance, minor repairs and adjustments to correct extrusion problems</li><li> Operator extrusion, downtime tracking and running sheets are completed</li><li> Packer relief as needed</li><li> Follow any reasonable request from a Supervisor</li><li> Follow KP Building's ISO quality management system</li><li> Participate in training as required by the company</li><li> Adhere to all applicable company policies and procedures, including quality and health and safety</li></ul><p><strong>Qualifications:</strong></p><ul><li> Competed high school diploma, GED, or equivalent</li><li> One (1) year experience as an extrusion operator within a manufacturing environment, preferably plastics extrusion is an asset</li><li> Machine Operator experience an asset and willing to learn</li><li> Ability to lift up to 50 lbs</li><li> Mechanically inclined and willing to learn</li></ul><p>We thank all candidates for their interest, however only those candidates who meet the requirements of the role will be contacted.</p><p><em>KP Products is committed to creating a diverse environment and is proud to be an equal opportunity employer. Upon request, KP Products will provide reasonable accommodation for disabilities to support participation of candidates in all aspects of the recruitment process.</em></p></section>","['Competed high school diploma, GED, or equivalent', 'Shifts: 12h continental shifts / Rotating every 2 weeks – Day and NightSalary starting at: $18.00 per hour', ""What's in it for YOU?Want to advance in your career and earn more? Would you enjoy a direct hire, full time opportunity that offers 3-4 days off a week? Earn more as you learn more in this career with a stable organization that will invest in your future, helping you advance and increase your value."", 'If you have production, warehouse, construction or related experience, this is a career you need to explore.', 'Ongoing training initiatives', 'Maintain housekeeping of your lines and workstation', 'Help other operators when needed', ""Join KP Building Products' Production team in Brampton, ON."", 'Machine Operator experience an asset and willing to learn', 'Make all quality checks as required. Finished products must match all quality standards assigned. (eg. Cosmetic, Functional, and Appearance etc.)', 'Health and Dental benefits', 'Follow any reasonable request from a Supervisor', 'Mechanically inclined and willing to learn', 'Keep in contact, if need arises, with Lead Hand Operator, Packer and Production Supervisor when changes occur. (eg. colour changes, scrapping, etc.)', 'One (1) year experience as an extrusion operator within a manufacturing environment, preferably plastics extrusion is an asset']"
13,13,Progressive Set Up Operator - Afternoon Shift,Magna,"VAUGHAN, MB",https://www.monster.ca/job-openings/progressive-set-up-operator-afternoon-shift-vaughan-08--341b37aa-c197-48de-a7cd-86de4b447c3b?sid=7affa032-6daf-4ecf-91c7-f7f493b56447&jvo=m.go.sc.14&_ga=2.131341455.1277025919.1651864384-1420397846.1651864384&hidesmr=1,"<section class=""cached-bot-fjv-skeletonstyle__CachedSkeletonDescription-sc-gqtazs-0 gbrdjA""><div><p></p><p> </p><p style=""text-align:justify""> </p><p style=""text-align:justify""><b>Job Number:</b> 12234 <br/><b>Group:</b> Magna Exteriors  <br/><b>Division</b>: Mytox Mfg. <br/><b>Job Type:</b> Permanent/Regular <br/><b>Location:</b> VAUGHAN </p><p style=""text-align:justify""> </p><p style=""text-align:justify""><b>Group Description</b></p><p style=""text-align:justify"">The Magna Exteriors portfolio of products includes access systems such as liftgates, exterior trim, modular systems, front-end modules including fascia, active aerodynamic systems and other lightweight structural components for automotive, commercial truck and other industrial markets.</p><p style=""text-align:justify"">Recognized globally as an innovator in all aspects of vehicle exteriors, Magna provides everything needed, from materials development and design through manufacturing and assembly, to help automakers create sleek, state-of-the-art vehicles across the world.</p><p> </p><div><div style=""padding:10px 0px;border:1px solid transparent""><div style=""font-size:16px;word-wrap:break-word""><b>QUALIFICATIONS NECESSARY TO DO THE JOB:</b></div><div><ul><li>Must have knowledge of First and Last Off Procedure</li><li>Must have knowledge of loading, unloading and storing of tooling equipment in appropriate area</li><li>Knowledge of press controls and tooling protection or other pieces of equipment to run a press</li><li>Valid forklift license and ability to operate 6000 lb. to 12000 lb. lift trucks</li></ul></div></div><div style=""padding:10px 0px;border:1px solid transparent""><div style=""font-size:16px;word-wrap:break-word""><b>DESIRABLE ADDITIONAL QUALIFICATIONS:</b></div><div><ul><li>3 years experience as a Progressive Press Set-Up Operator</li><li>Must have knowledge to set all tooling for all presses</li></ul><ul><li>Must have knowledge of operating presses for both manual and progressive dies</li><li>Must have knowledge of all Inspection Records, SPC Charts and checking fixtures</li><li>Must have knowledge of measuring equipment, such as; micrometer and vernier, caliper</li><li>Must have experience in starting and shutting down of all equipment necessary to run appropriate press</li><li>Knowledge on how to inspect press and tooling at the beginning of the shift</li><li>Experience in tooling set-up with roll feeders and die protection</li><li>Knowledge of WHMIS</li><li>Good organizational skills, ability to work well without supervision</li></ul></div></div><div style=""padding:10px 0px;border:1px solid transparent""><div style=""font-size:16px;word-wrap:break-word""><b>MAIN DUTIES AND ACTIVITIES OF JOB:</b></div><div><p>•    Ensure that at all times prior to set–up, safety checklist is followed, completed and recorded<br/>•    Must be able to organize, properly prepare and have foresight to be fully equipped to set-up utilizing a quick die change system<br/>•    Ability to follow written set-up instructions and fill out proper set-up papers<br/>•    Must be able to communicate issues/problems to area leader<br/>•    Ability to operate safely 10 to 40 ton cranes with appropriate sling or chain. Must have training certificate<br/>•    Must have knowledge to properly set counter balance air according to tool weight<br/>•    Ability to load coils on uncoilers, preparation for use, and start strip through die<br/>•    Ability to input production data into the system and follow required schedule<br/>•    Must be able to work overtime when required and willing to help out when necessary as per customer demands<br/>•    Must be organized and clean up before and after set-up, including moping of the floor<br/>•    Utilizes effective Housekeeping Practices<br/>•    Adheres to all Mytox safety rules and regulations<br/>•    Follows all applicable Mytox BOS procedures<br/>•    Any other reasonable request by management<br/> </p></div></div><div style=""padding:10px 0px;border:1px solid transparent""><div style=""font-size:16px;word-wrap:break-word""><b>Additional Information</b></div><div><p>Accommodations for disabilities in relation to the job selection process are available upon request.</p></div></div></div><p style=""margin-left:10px;text-align:justify"">07--Operations F--Permanent/Regular </p></div></section>","['Must have knowledge of all Inspection Records, SPC Charts and checking fixtures', 'Must have experience in starting and shutting down of all equipment necessary to run appropriate press', 'Must have knowledge of First and Last Off Procedure', 'Valid forklift license and ability to operate 6000 lb. to 12000 lb. lift trucks', 'Must have knowledge to set all tooling for all presses', 'Must have knowledge of operating presses for both manual and progressive dies', 'Good organizational skills, ability to work well without supervision', 'Recognized globally as an innovator in all aspects of vehicle exteriors, Magna provides everything needed, from materials development and design through manufacturing and assembly, to help automakers create sleek, state-of-the-art vehicles across the world.', 'Experience in tooling set-up with roll feeders and die protection', 'Must have knowledge of measuring equipment, such as; micrometer and vernier, caliper', '3 years experience as a Progressive Press Set-Up Operator', 'Must have knowledge of loading, unloading and storing of tooling equipment in appropriate area']"
