,Unnamed: 0,title,company,location,link,description,skills
0,0,Asistant Setup,Magna,,https://www.monster.ca/job-openings/asistant-setup--2749336f-895d-4ad3-b3aa-dbfcc41036b7?sid=7affa032-6daf-4ecf-91c7-f7f493b56447&jvo=m.go.sc.1&_ga=2.131341455.1277025919.1651864384-1420397846.1651864384&hidesmr=1,"<section class=""cached-bot-fjv-skeletonstyle__CachedSkeletonDescription-sc-gqtazs-0 gbrdjA""><div><p></p><p> </p><p style=""text-align:justify""><b>Numer stanowiska:</b> 44082<br/><b>Grupa:</b> Magna Mechatronics, Mirrors &amp; Lighting<br/><b>Oddział:</b> Magna Lighting<br/><b>Rodzaj stanowiska:</b> stałe<br/><b>Miejscowość:</b> Kostrzyn nad Odrą</p><p> </p><p style=""text-align:justify""><b>Opis grupy</b></p><p style=""text-align:justify"">Grupa Mechatronics, Mirrors and Lighting specjalizuje się w technologiach motoryzacyjnych, które kształtują przyszłość mobilności. Czerpiąc z głębokiej wiedzy o systemach, MML opracowuje wyjątkowe technologie dostępu do pojazdów, inteligentne systemy wizyjne i zaawansowane technologie oświetlenia pojazdów, wytyczając nowe drogi do innowacyjności, bezpieczeństwa i stylistyki.</p><p> </p><div><div style=""padding:10px 0px;border:1px solid transparent""><div style=""font-size:16px;word-wrap:break-word""><h2 style=""font-size:1em;margin:0px""><b>Kluczowe obowiązki</b></h2></div><div><p>•    Montaż form wtryskowych na maszynę wtryskową<br/>•    Podłączanie formy według schematu z karty technologicznej  <br/>•    Zapewnienie optymalnych parametrów technologicznych maszyn podczas produkcji zgodnie z kartą technologiczną<br/>•    Pakowanie wyprasek <br/>•    Dbałość o utrzymanie porządku na stanowisku pracy</p></div></div><div style=""padding:10px 0px;border:1px solid transparent""><div style=""font-size:16px;word-wrap:break-word""><h2 style=""font-size:1em;margin:0px""><b>Kluczowe kwalifikacje/wymagania</b></h2></div><div><p>•    Wykształcenie zasadnicze zawodowe lub średnie techniczne o profilu: mechanik<br/>•    Doświadczenie w firmie produkcyjnej przy obsłudze wtryskarek lub na podobnym stanowisku<br/>•    Wiedza teoretyczna  z zakresu obróbki tworzyw sztucznych <br/>•    Umiejętność pracy w zespole <br/>•    Dokładność i sumienność <br/>•    Szybkość w działaniu</p></div></div><div style=""padding:10px 0px;border:1px solid transparent""><div style=""font-size:16px;word-wrap:break-word""><h2 style=""font-size:1em;margin:0px""><b>Świadomość. Jedność. Wzmocnienie.</b></h2></div><div><p style=""text-align:justify"">W Magna wierzymy, że zróżnicowana siła robocza ma kluczowe znaczenie dla naszego sukcesu. Dlatego też jesteśmy dumni z tego, że jesteśmy pracodawcą oferującym równe szanse. Zatrudniamy na podstawie doświadczenia i kwalifikacji oraz z uwzględnieniem wymogów stanowiska, bez względu na, w szczególności, kolor skóry, pochodzenie, wyznanie, płeć, pochodzenie, orientację seksualną, wiek, obywatelstwo, stan cywilny, niepełnosprawność lub tożsamość płciową. Magna poważnie traktuje ochronę Państwa danych osobowych. Odradzamy wysyłanie aplikacji pocztą elektroniczną w celu zapewnienia zgodności z RODO i lokalnymi wymogami dotyczącymi prywatności danych.</p></div></div></div><p> </p><p> </p></div></section>",[]
1,1,Setup Operator / Full-Time Production,The Original Cakerie,"London, ON",https://www.monster.ca/job-openings/setup-operator-full-time-production-london-08--54dd769f-3b9e-42d0-832b-2c096d53771f?sid=7affa032-6daf-4ecf-91c7-f7f493b56447&jvo=m.go.sc.2&_ga=2.131341455.1277025919.1651864384-1420397846.1651864384&hidesmr=1,"<section class=""cached-bot-fjv-skeletonstyle__CachedSkeletonDescription-sc-gqtazs-0 gbrdjA""><p> </p><p>Dessert Holdings is a leading baked goods platform providing premium layer cakes, cheesecakes, brownies, bars, and other desserts to the retail in-store bakery (""ISB"") and foodservice channels on a largely private label basis. We are a rapidly growing company comprised of The Original Cakerie (acq. December 2015), Lawler's Foods (acq. July 2016), and Atlanta Cheesecake Company (acq. January 2018). We are poised for continued growth by bringing high quality products to both retail grocery and food service across North America. Led by a senior team with strong company pedigrees and experience driving improvement – we have exciting opportunities to be a part of this high performance, growth focused organization.    </p><p>We currently have an opportunities for <strong>Setup Operator / Full time production </strong>personnel to join our team. </p><p><strong>Position Description: </strong></p><p>This position performs all duties assigned by the Setup Manager, Supervisor and Shift Operations Manager. </p><p><strong>Responsibilities &amp; Duties:  </strong><em>(This is meant to be an outline, not an exhaustive list of responsibilities)</em></p><ul><li>Equipment set up and troubleshooting adjustments, to keep products within standard and to keep all the lines running at or above required performance.</li><li>Maintaining the required hygiene standards of the equipment and the facility, consistent with GMP standards and Master Sanitation Schedules.</li><li>Removing waste from the production areas as needed.</li><li>Safe use, storage, and maintenance of all company supplied cleaning equipment and materials.</li><li>Supporting contract cleaning and maintenance services when necessary.</li><li>Maintaining all BRC audit paperwork and other required documentation as may be required.</li><li>Liaising with appropriate staff throughout the shift to ensure continuous process and quality standards.</li><li>Supporting line staff on day-to-day basis for general troubleshooting/problem-solving/conflict resolution.  Get rid of this line.</li><li>Adhering to safety, quality and performance standards.</li><li>Supporting training and continuous learning activities within the department.</li><li>Responsible to practice the 5 steps of cleaning at all times</li></ul><p><strong>Position Requirements:  </strong></p><ul><li>Comfortable working with exposure to cold temperatures</li><li>Ability to work independently, well organized, effective judgment</li><li>Mechanical aptitude is a requirement</li><li>Accountable for the Master Cleaning Schedule</li><li>Excellent attendance record and demonstrated reliability</li><li>Ability to perform heavy lifting, climb stairs, navigate around equipment, and work with a sense of urgency</li><li>Cooperative and works well with others, strong communicator</li><li>Willing and able to be trained on working at heights and safe use of aerial platform equipment (Genie-boom Lifts, Scissor Lifts)    </li></ul><p><strong>Schedule: Flexible Monday - Saturday (working 8 hour shifts, 5 out of the 6 days each week)</strong></p><p><strong>Currently have openings on our ""C"" shift</strong></p><p><strong>C shift 5:00pm - 1:30am or 9:30pm - 6:00am</strong></p><p><strong>You must be available for each start time on the specified shift.</strong></p><p><strong>Setup shifts will be prioritized and backfilled with productions shifts.</strong></p><p><strong>Pay rates:</strong>  <strong>- When working as Setup </strong>P<strong>robationary rate - $21.81/hour ; Full rate - $24.24/hour</strong></p><p><strong>                     When working as Production </strong>P<strong>robationary rate - $18.06/hour ; Full rate - $20.08/hour</strong></p><p>                     </p><p>This position also provides comprehensive benefits package and RRSP contributions after probation is complete.</p><p>We appreciate your interest in joining The Original Cakerie team.  Due to volume of candidates applying, only short listed applicants will be contacted.</p><p>HPAPP</p><p> </p></section>","['Accountable for the Master Cleaning Schedule', 'Maintaining the required hygiene standards of the equipment and the facility, consistent with GMP standards and Master Sanitation Schedules.', 'Liaising with appropriate staff throughout the shift to ensure continuous process and quality standards.', 'Responsible to practice the 5 steps of cleaning at all times', 'Cooperative and works well with others, strong communicator', 'Comfortable working with exposure to cold temperatures', 'We\xa0currently have\xa0an opportunities\xa0for\xa0Setup Operator / Full time production\xa0personnel to join our team.', 'Pay rates:\xa0 - When working as Setup\xa0Probationary rate - $21.81/hour ; Full rate - $24.24/hour', 'Maintaining all BRC audit paperwork and other required documentation as may be required.', 'Excellent attendance record and demonstrated reliability', 'Removing waste from the production areas as needed.', 'Mechanical aptitude is a requirement', 'Safe use, storage, and maintenance of all company supplied cleaning equipment and materials.', 'Supporting training and continuous learning activities within the department.', 'Supporting line staff on day-to-day basis for general troubleshooting/problem-solving/conflict resolution.\xa0 Get rid of this line.', 'Currently have openings on our ""C"" shift', 'Supporting contract cleaning and maintenance services when necessary.', 'Willing and able to be trained on working at heights and safe use of aerial platform equipment (Genie-boom Lifts, Scissor Lifts)', 'Adhering to safety, quality and performance standards.', 'When working as Production\xa0Probationary rate - $18.06/hour ; Full rate - $20.08/hour', 'You must be available for each start time on the specified shift.']"
2,2,Permanent Setup Operator,Randstad Canada,"Ingersoll, ON",https://www.monster.ca/job-openings/permanent-setup-operator-ingersoll-08--40a60d58-bb4a-482b-a861-d0c5725f2e47?sid=7affa032-6daf-4ecf-91c7-f7f493b56447&jvo=m.go.sc.3&_ga=2.131341455.1277025919.1651864384-1420397846.1651864384&hidesmr=1,"<section class=""cached-bot-fjv-skeletonstyle__CachedSkeletonDescription-sc-gqtazs-0 gbrdjA"">Are you a machine operator with experience in various manufacturing environments? Do you know how to set up equipment and troubleshoot adjustments? Do you maintain a clean and orderly work environment?<br/><br/>We would like to meet you! <br/><br/>Come and be part of a team of machine operators in a large manufacturing company in Ingersoll, Ontario. You will be responsible for setting up and running machinery for flat-rolled steel. Some hand and power tool and drill press experience will be an asset to assembling and finishing steel when required.<br/><br/>Job Title: Set Up Operator - Flat-rolled steel<br/>Location: Ingersoll, Ontario<br/><br/>Shift: Bi-weekly rotations of days and afternoons<br/>Hours: 6 am to 2 pm and 2 pm to 10 pm (Monday to Friday)<br/> Pay rate: $18.89 hourly to start, at 3 months there will be a pay increase to $20.91 hourly and at 1 year an increase to $25.27 hourly<br/><br/><br/><b>Advantages</b><br/>Why make the job change?<br/><br/>Permanent job opportunity<br/>Long-term job opportunity<br/>Full-time hours<br/>Pay increases 2 times in the first year up to $25.27 an hour<br/>Benefits after 3 months<br/>RRSP and Pension benefits after 3 months<br/>2 weeks paid vacation first year<br/>Overtime available after 40 hours<br/>Bonus pay<br/>Training involved<br/>Welcoming environment to new employees<br/>Strong team-oriented company<br/><br/><b>Responsibilities</b><br/>Be a reliable team member who works at all times focusing on Safety and Accuracy while being productive.<br/><br/>1. Set up machine according to production schedule<br/>2. Maintain correct locations for tooling<br/>3. Maintain tooling with great care<br/>4. Clean tooling before installing on arbor<br/>5. Ensure the knives are of the highest quality<br/>6. Inspect set up for accuracy<br/>7. Maintain and improve all daily procedures<br/>8. Increase safety and productivity at highest level of quality<br/>9. Maintain and improve a high level of health and safety<br/>10. Build set up according to ASKO<br/>11. Ensure correctness of order from start to finish<br/>12. Troubleshooting of slitting problems<br/>13. Assist operators with loading and unloading of material<br/>14. Build separators as required<br/>15. Assist packager<br/>16. Maintain a clean work area<br/>17. Other duties as assigned by plant supervisor/management<br/><br/><b>Qualifications</b><br/>Who are we looking for?<br/><br/>Someone with machine operating experience<br/>High School diploma or greater<br/>1-2 year experience in manufacturing<br/>Forklift and crane experience asset<br/>Basic mechanical knowledge of machines is an asset<br/><br/><b>Summary</b><br/>How to apply:<br/><br/>To apply for this position email your resume to Oksana at oksana.chanas@randstad.ca<br/>Or call the office 519..679.0058 ext 1 and ask for Oksana or Jenny<br/>Or apply online at randstad.ca<br/><br/>We are text-friendly. Feel free to text us at 226-387-3922<br/><br/><br/>Are you interested in making your next career move, but this one doesn’t sound right? Please give us a call – we have an extensive list of open positions in the Brantford area. We look forward to speaking with you!<br/><br/>If this job is not for you, but you’re interested in a career change, please call the phone number above and let us know what you’re looking for. We would love to help find you your dream job!<br/><br/>Make sure you download our new app called 'myrandstad' in the Google Play Store or the App Store and give us a call so we can set you up with a pin. This is the new way to get all the latest job notifications! If you need help setting up the app just stop by our office or give us a call and we'll be happy to help!<br/><br/><a href=""/"" rel=""nofollow"">Randstad Canada</a> is committed to fostering a workforce reflective of all peoples of Canada. As a result, we are committed to developing and implementing strategies to increase the equity, diversity and inclusion within the workplace by examining our internal policies, practices, and systems throughout the entire lifecycle of our workforce, including its recruitment, retention and advancement for all employees. In addition to our deep commitment to respecting human rights, we are dedicated to positive actions to affect change to ensure everyone has full participation in the workforce free from any barriers, systemic or otherwise, especially equity-seeking groups who are usually underrepresented in Canada's workforce, including those who identify as women or non-binary/gender non-conforming; Indigenous or Aboriginal Peoples; persons with disabilities (visible or invisible) and; members of visible minorities, racialized groups and the LGBTQ2+ community.<br/><br/><a href=""/"" rel=""nofollow"">Randstad Canada</a> is committed to creating and maintaining an inclusive and accessible workplace for all its candidates and employees by supporting their accessibility and accommodation needs throughout the employment lifecycle. We ask that all job applications please identify any accommodation requirements by sending an email to <p>accessibility@randstad.ca</p> to ensure their ability to fully participate in the interview process.</section>",[]
3,3,Profile Plastic Extrusion Operator,Agilus Work Solutions,"Winnipeg, MB",https://www.monster.ca/job-openings/profile-plastic-extrusion-operator-winnipeg-03--02aa3b77-8c22-46bf-900a-cf95bcf9950a?sid=7affa032-6daf-4ecf-91c7-f7f493b56447&jvo=m.go.sc.4&_ga=2.131341455.1277025919.1651864384-1420397846.1651864384&hidesmr=1,"<section class=""cached-bot-fjv-skeletonstyle__CachedSkeletonDescription-sc-gqtazs-0 gbrdjA"">Description: <div>We are currently seeking an experienced Plastic Extrusion Machine Operator for our client who prides themselves on their production based on innovative designs.<br/>Agilus is recruiting for a Plastic Extrusion Machine Operator in the skilled trades in Winnipeg, Manitoba.<br/>This position is a full-time permanent role situated in St. Boniface area. Our client is a well known manufacturing company of quality plastic products and leads in providing the best customer service to its clientele.<br/>Duties:<ul><li>• Select Machine Dies</li><li>• Synchronize speed of extrusions</li><li>• Ensure conformance to specifications / adjust as necessary</li><li>• Set control to regulate vacuum, air pressure, sizing rings and temperature</li><li>• Troubleshoot and make minor adjustments to equipment</li><li>• Pack items for shipping and distribution</li><li>• Monitor and inspect quality of material produced</li></ul><br/>Requirements:<ul><li>• Must have a forklift operator certification</li><li>• Must have 1-2 years of extrusion experience in a similar role</li><li>• Good communication skills, written and verbal</li><li>• Available to work in evening shift</li><li>• Must have a valid driver's license and a reliable vehicle</li></ul><br/>What's in it for you:<ul><li>Competitive salary is offered based on experience.</li><li>Benefits package and paid vacation</li></ul><br/>Interested?<br/>Please apply directly online or contact Charmaine by email cpadaoan@agilus.ca<br/>Agilus would like to thank all candidates for their interest in this opportunity. Due to the volume of resumes we receive; we may only be able to respond directly to those candidates being selected for an interview.<br/>We encourage you to visit agilus.ca regularly or subscribe to our email alerts at agilus.ca/Account/Register as new exciting employment opportunities become available daily.<br/><br/></div>We value a diverse workplace.<br/>Agilus Work Solutions is committed to employ people from diverse backgrounds and we actively demonstrate inclusiveness through fair, equitable and accessible hiring practices. We recognize the strength that comes from different experiences, backgrounds and perspectives and welcome candidates who identify as visible minorities, Indigenous people, persons with disabilities, and persons within the LGBTQ+ community. We feel it is important as an organization that all people have access and opportunity to be employed, to be valued and to be respected.<br/><br/> Accommodations for job applicants with disabilities will be provided upon request during the recruitment, assessment, selection and placement process. Alternative format available onRequest.</section>","[""• Must have a valid driver's license and a reliable vehicle"", '• Available to work in evening shift', '• Ensure conformance to specifications / adjust as necessary', '• Good communication skills, written and verbal', '• Must have a forklift operator certification', 'Competitive salary is offered based on experience.', '• Must have 1-2 years of extrusion experience in a similar role']"
4,4,Day Shift Extrusion Machine Operator,TC Transcontinental,Thomasville,https://www.monster.ca/job-openings/day-shift-extrusion-machine-operator-thomasville-07--d86b0a87-58c1-467a-a950-a0fa306c989d?sid=7affa032-6daf-4ecf-91c7-f7f493b56447&jvo=m.go.sc.5&_ga=2.131341455.1277025919.1651864384-1420397846.1651864384&hidesmr=1,"<section class=""cached-bot-fjv-skeletonstyle__CachedSkeletonDescription-sc-gqtazs-0 gbrdjA""><h1 style=""margin-top:16px""><b style=""color:black"">Day Shift Extrusion Operator<br/>12 hour 8p-8a, 2-2-3 rotation<br/>TC Transcontinental, Making Impressions Count</b></h1>TC Transcontinental is a leader in flexible packaging in North America, and Canada’s largest printer. The Corporation is also the leading Canadian French-language educational publishing group. For over 40 years, TC Transcontinental’s story has been one of innovation and transformation to meet our customers’ evolving needs. Our strong family values, entrepreneurial spirit and long-term vision have always been at the heart of our success.  With our 3 business sectors of Packaging, Print and Media, we continue to optimize, transform and grow while making impressions that count! <br/><b>TC Transcontinental Packaging</b> brings a distinctive blend of Art, Science and Technology to create flexible packaging that preserves our customers' products and accentuates their brands on the store shelf. The Packaging Sector has over 4,000 employees and 25 facilities worldwide specializing in extrusion, lamination, printing and converting of plastic products.  <br/>We share the <b>Ellen MacArthur Foundation’s</b> vision of a circular economy for plastic, where plastic never becomes waste and have committed, by 2025, for 100% of our plastic packaging to be reusable, recyclable or compostable. And most recently, we joined the <b>United Nations Global Compact</b> – a voluntary initiative of signatory companies committing to social responsibilities around human rights, labor standards and environmental protection.  You will join a high-performing team that is dedicated to sustainability and passionate about our people, operations, communities and products.<br/><br/><b>About this opportunity </b><br/><br/>This position will report to the Shift Supervisor. Performs machine set-up for orders, safely operates machine to production target, waste, and quality standards, and trouble shoots machine when it is down or not performing to standard.  <br/><br/><b>What you will do</b><ul><li style=""text-align:justify;margin-left:8px"">Read orders, select proper resins and additives. </li><li style=""text-align:justify;margin-left:8px"">Operate extruders and resin-handling equipment.</li><li style=""text-align:justify;margin-left:8px"">Operate extruders at maximum output with minimum scrap generated.</li><li style=""text-align:justify;margin-left:8px"">Make necessary quality checks utilizing micrometer, and dyne test solutions.</li><li style=""text-align:justify;margin-left:8px"">Keep all necessary records including production, quality control, time utilization and material usage.</li><li style=""text-align:justify;margin-left:8px"">Clean dyes, changes dyes and screen packs.</li><li style=""text-align:justify;margin-left:8px"">Responsible for routine operating maintenance.</li><li style=""text-align:justify;margin-left:8px"">Responsible for labeling material and moving rolls and carts to staging area.</li><li style=""text-align:justify;margin-left:8px"">Abide by all rules and procedures that govern the extrusion department.</li><li style=""text-align:justify;margin-left:8px"">Support and contribute to a healthy and safe work environment by following all workplace regulations, policies, and initiatives, including reporting all first aid injuries, accidents, and workplace hazards. </li></ul><br/><b>What you have to offer</b><ul><li style=""text-align:justify;margin-left:8px"">High School Diploma with 2+ years in general warehouse operations. </li><li style=""text-align:justify;margin-left:8px"">Ability to read and understand simple written materials.  Ability to write simple statements and numbers. Ability to perform arithmetic calculations with fractions and decimals.</li><li style=""text-align:justify;margin-left:8px"">Previous blown film extrusion experience preferred as well as minor mechanical troubleshooting            experience.</li><li style=""text-align:justify;margin-left:8px"">Average dexterity and coordination. Ability to climb stairs and lift up to 50lbs. </li><li style=""text-align:justify;margin-left:8px"">Frequent mental/visual attention to monitor extruder operation. Ability to distinguish colors.</li><li style=""text-align:justify;margin-left:8px"">Must be able to work in a team environment.   Must adhere to plant safety and housekeeping standards.</li></ul><br/><br/><b>What we have to offer</b><ul><li>Opportunity to be part of a dynamic and highly motivating work environment where you can develop your potential and launch an exciting career.</li><li style=""text-align:justify"">Development opportunities where your input makes a difference. A competitive compensation package, 401K plan and flexible benefits that are customizable to you and your family’s needs]; </li><li>Employee perks such as discounts from suppliers on various products and services such as insurance, wireless bundles, travel, and much more.  </li></ul><br/><b>Learn more about us </b><br/><a href=""https://tctranscontinental.com/en-us/packaging"" rel=""nofollow"" style=""color:#0563c1;text-decoration:underline"">https://tctranscontinental.com/en-us/packaging</a><br/><a href=""https://www.facebook.com/TC-Transcontinental-Packaging"" rel=""nofollow"" style=""color:#0563c1;text-decoration:underline"">https://www.facebook.com/TC-Transcontinental-Packaging</a><br/><p>talent@tc.tc</p><b></b><br/><b>#INDUS</b><br/><br/><br/></section>","['Clean dyes, changes dyes and screen packs.', 'Frequent mental/visual attention to monitor extruder operation. Ability to distinguish colors.', 'Previous blown film extrusion experience preferred as well as minor mechanical troubleshooting\xa0\xa0\xa0\xa0\xa0\xa0\xa0\xa0\xa0\xa0\xa0 experience.', 'Must be able to work in a team environment.\xa0\xa0 Must adhere to plant safety and housekeeping standards.', 'Operate extruders at maximum output with minimum scrap generated.', 'Read orders, select proper resins and additives.', 'Average dexterity and coordination. Ability to climb stairs and lift up to 50lbs.', 'Make necessary quality checks utilizing micrometer, and dyne test solutions.', 'High School Diploma with 2+ years in general warehouse operations.', 'Responsible for labeling material and moving rolls and carts to staging area.', 'Abide by all rules and procedures that govern the extrusion department.', 'Responsible for routine operating maintenance.', 'Keep all necessary records including production, quality control, time utilization and material usage.', 'Operate extruders and resin-handling equipment.']"
